,location,company,summary,jkid,title,salary,stars,reviews,post_date,pull_date
266,"McCook, IL",Talascend LLC,Utilizes established mathematical and scientific techniques to compile and analyze data. Requires a bachelor's degree and 0-4 years of experience in an...,520643d26dee4ea3,"Research & Development Engineer/Scientist - McCook, IL",,43.8,4,5 days,2016-10-17 21:24:16.414864
267,"Chicago, IL","Collaborative for Academic, Social, and Emotional...","In coordination with senior scientist, conduct policy scans, reviews and content analyses of state standards across the country in order to continually update...",9c8e4a40f41120f0,Research Project Manager,,,,13 days,2016-10-17 21:24:16.414864
268,"Chicago, IL",Morningstar,"Consisting of marketing managers, designers, writers, corporate communications professionals, digital strategists, behavioral scientists, and more, this...",f8c050c866ecd8c9,Content Manager,,43.8,45,30+ days,2016-10-17 21:24:16.414864
269,"Melrose Park, IL",Fresenius Kabi,Provides project support to Scientist and Lead Scientist. Assists Scientist / Lead Scientist with test method validations and special projects....,e1c0553f9f72cc79,ASSOCIATE SCIENTIST (MP00742),,44.4,68,9 days,2016-10-17 21:24:16.414864
270,"Chicago, IL",Civis Analytics,"PhD in microeconomics, econometrics, statistics, physics, or a comparable subject-- ABD with outstanding work or publication record may be considered....",42989814f0f63073,Senior Data Scientist - Statistics,,,,30+ days,2016-10-17 21:24:16.414864
271,"Chicago, IL","Geosyntec Consultants, Inc.","Our engineers, geologists, environmental scientists, and other technical and project staff specialize in the areas of contaminated site assessment and...",705a9e1cdb09a6ba,Entry-Level Civil / Geotechnical Engineer (40291),,,,30+ days,2016-10-17 21:24:16.414864
272,"Glenview, IL",SC Business Unit 3,"Our engineers, scientists, consultants, construction managers, and affiliated professionals work together to deliver smart solutions to our public and private...",61ca277671f02de4,Plumber,,,,3 days,2016-10-17 21:24:16.414864
273,"Chicago, IL 60654 (Loop area)",Tempus,"Work in interdisciplinary groups of scientists, engineers, and product developers to translate research into clinically actionable insights for our clients....",41c3a52c76e9faa7,Computational Biologist- Tumor Biology,,51.0,7,30+ days,2016-10-17 21:24:16.414864
274,"Oakbrook Terrace, IL",Cox Automotive,"The Campaign Marketing Manager (CMM) serves as the marketing teams chief data scientist, leading the campaign analytics practice and campaign data strategy for...",cd0ee82a43928bb9,"Manager, Campaign Marketing",,40.8,42,11 days,2016-10-17 21:24:16.414864
275,"Chicago, IL",Northwestern University,"Under the direction of research scientists, and reporting to the PI, perform a wide variety of duties related to the conduct and analysis of clinical research...",873888ae93d1a306,Research Study Assistant,,52.199997,174,30+ days,2016-10-17 21:24:16.414864
276,"Chicago, IL",Chamberlain Advisors,"Master’s or PhD level degree within a highly quantitative subject such as statistics, physics, or mathematics....",5fcb6f5fe79ca7b0,Senior Quantitative Analyst,,,,13 days,2016-10-17 21:24:16.414864
277,"Elk Grove Village, IL 60007",ADP,"At ADP, the world's largest B2B cloud company, our Technology team is comprised of brilliant engineers, architects, data scientists, infrastructure experts, and...",a97367bda4c601c9,Critical Incident Manager,,44.4,1657,19 days,2016-10-17 21:24:16.414864
278,"Chicago, IL",University of Chicago,"The Open Science Data Cloud (OSDC) provides the scientific community with resources for storing, sharing, and analyzing terabyte- and petabyte-scale scientific...",a331416428dd4e53,Senior Software Engineer,,52.800003,226,7 days,2016-10-17 21:24:16.414864
279,"Chicago, IL",Chamberlain Advisors,Manage and maintain the Quantitative Risk Management department’s technical documentations including model research papers and margin / risk methodology...,29141639115a6c65,Business Analyst / Technical Writer - Quantitative Risk Mana...,,,,13 days,2016-10-17 21:24:16.414864
280,"Chicago, IL",Aon,"Creating access to health care and retirement for millions, Aon. By applying for a position with Aon, you....",b706dea54d2dfbbe,Sr. Analyst-Fixed Income Manager Research,,43.2,1645,30+ days,2016-10-17 21:24:16.414864
281,"Chicago, IL 60601 (Loop area)",Strike Social,"Collaborate with data scientists and graphic artists to create infographics, data reports and more that position Strike as an industry expert....",7d6e1df4187fae24,Senior Content Manager,,,,30+ days,2016-10-17 21:24:16.414864
282,"Chicago, IL 60601 (Loop area)",Allstate Insurance,"The Data Scientist family is accountable for using data to make decisions, which includes building predictive models and developing new machine learning...",0a67859f19d5d037,Senior Automation Data Scientist,,44.4,2837,30+ days,2016-10-17 21:24:16.414864
283,"Chicago, IL 60654 (Loop area)",Tempus,"But, even as genomic sequencing has become less expensive and more widely available, cancer patients are treated in much the same way today as they were decades...",a50dc974dbc02c74,Digital Marketing Manager,,51.0,7,30+ days,2016-10-17 21:24:16.414864
284,"McCook, IL",Honeywell,"Providing project management support, resource planning and develop budgets for capital projects. Providing process control and data acquisition support for the...",8ce3d24b43cbeb17,Engineer/Scientist Sr R&D 1,,44.4,3477,13 days,2016-10-17 21:24:16.414864
285,"Rolling Meadows, IL",Illinois Technology Association,"They lead teams of designers, engineers, data scientists and analysts to define product strategy and develop, launch, and enhance products and services that...",1ef9343412013711,Capital One - Digital Product Manager - Case Management Team,,,,2 days,2016-10-17 21:24:16.414864
286,"Evanston, IL",Northwestern University,"This individual will be a member of CAMI and joining a team of research scientists and technicians, who are part of the Chemistry of Life Processes (CLP)...",5a4f370869f17665,"Research Associate, Nuclear Imaging",,52.199997,174,30+ days,2016-10-17 21:24:16.414864
287,"Chicago, IL",Civis Analytics,"Master’s degree in a technical field,such as statistics, machine learning, physics, engineering, or computer science, or a bachelor’s degree and outstanding...",2f6f9508fb53a047,Senior Data Scientist - Engineering,,,,30+ days,2016-10-17 21:24:16.414864
288,"Harvey, IL",Fuchs Lubricants Co.,"Able to manage multiple projects, report on technical subjects and to be a diligent problem solver, while maintaining a clear sense of priorities and focus....",ddb9a06dd34f4401,R&D Chemist/ Scientist,,,,17 days,2016-10-17 21:24:16.414864
289,"Chicago, IL","Nuveen Investments, LLC",Bachelor’s degree and 5 to 8 years of relevant investment experience is required. Nuveen Asset Management’s Real Asset investment philosophy incorporates an...,a919e2f350ece8f2,Senior Research Analyst - Global Real Asset Debt,,,,30+ days,2016-10-17 21:24:16.414864
290,"Chicago, IL 60601 (Loop area)",Allstate Insurance,"Data Scientists, Product Managers, Software Engineers, Your Customers, et al). Manage direct reports, as applicable....",faf7c92669b38dad,"Sr. Digital Product Manager, Data Platform",,44.4,2837,30+ days,2016-10-17 21:24:16.414864
291,"Chicago, IL",CDK Global,"From data scientists to sales and operations experts, we’re hiring to support your growth and ours - Green light your career ....",454d0dc7b30c9623,Sales Associate,,41.4,74,7 days,2016-10-17 21:24:16.414864
292,"Chicago, IL 60611 (Near North Side area)",Northwestern University,Experience with support of researchers and scientists. Must be able to manage a complex project and maintain accuracy while working on complex tasks....,bf882818cec6a5e2,Senior Developer,,52.199997,174,30+ days,2016-10-17 21:24:16.414864
293,"Chicago, IL",Workbridge Associates,"Mid, Senior, Lead, Data, Scientist, Machine, Learning, Predictive, Analytics, Engineer, Developer, Python, R, Hadoop, Hive, Impala, Spark, Storm, Pig,...",f1260107aa9cb7ed,Director of Data Science,"$200,000 a year",41.4,25,7 days,2016-10-17 21:24:16.414864
294,"Lemont, IL",Argonne National Laboratory,"Good experience and skills in interdisciplinary research involving mathematicians, computer scientists, and discipline scientists....",58c6d283ba87a539,Assistant Computational Scientist,,52.199997,79,30+ days,2016-10-17 21:24:16.414864
295,"Chicago, IL 60654 (Loop area)",Experis,"They work collaboratively with both product teams and data scientists in support of business goals. We need you to get your hands dirty with raw data, and...",2a6351254c341b1b,Product Manager- Machine Learning,,43.8,296,13 days,2016-10-17 21:24:16.414864
296,"Rolling Meadows, IL",Capital One,"They lead teams of designers, engineers, data scientists and analysts to define product strategy and develop, launch, and enhance products and services that...",20c64f5e57307e1e,Digital Product Manager - Case Management Team,,44.4,2904,2 days,2016-10-17 21:24:16.414864
297,"Chicago, IL",Federal Reserve Bank of Chicago,"Under the direction of the Data Scientist, collects, aggregates, and analyzes data from multiple internal sources to drive insights into business performance....",533d2fe81ef0efbf,Business Intelligence Analyst,,51.6,314,30+ days,2016-10-17 21:24:16.414864
298,"Chicago, IL 60601 (Loop area)",Marquette Associates Inc,Flexible spending plans for health care and dependent care; College degree with 5-10 investment related experience in the financial service sector or advanced...,9b0df93f3cae08c6,Research Analyst,,,,26 days,2016-10-17 21:24:16.414864
299,"Chicago, IL",Cray,"CRAY) provides innovative systems and solutions enabling scientists and engineers in industry, academia and government to meet existing and future simulation...",676560f539bb26cf,District Service Manager,,52.800003,3,30+ days,2016-10-17 21:24:16.414864
300,"Chicago, IL 60654 (Loop area)",Citizens United for Research in Epilepsy,"We identify and fund cutting-edge research, challenging scientists worldwide to collaborate and innovate in pursuit of this goal....",09b47ad297905486,"Manager, Special Events and Community Engagement",,,,12 days,2016-10-17 21:24:16.414864
301,"Lemont, IL",Argonne National Laboratory,"With renowned scientists from around the world, the Institute for Molecular Engineering is defining a nascent field of study that has the potential to address...",14d5033d335fb160,Postdoctoral Appointee - Institute for Molecular Engineering...,,52.199997,79,6 days,2016-10-17 21:24:16.414864
302,"Chicago, IL 60611 (Near North Side area)",Levy Restaurants,"Retrieve and assess large volumes of data from clients and their source systems using SQL, R, and similar tool sets....",40f15e78e8bb8e68,Market Research Analyst,,44.4,519,30+ days,2016-10-17 21:24:16.414864
303,"Itasca, IL",National Safety Council,"Analyzes and interprets survey data. Courses in health and safety, statistics, psychometrics, survey research, research methods or experimental design....",1d57c7e5adfd82a6,Senior Survey Research Analyst,,43.2,17,30+ days,2016-10-17 21:24:16.414864
304,"Chicago, IL 60654 (Loop area)",Tempus,"Experience in genomic medicine, deep phenotyping, clinical data mining, adverse drug events, drug-drug interactions, clinical data mining, network medicine,...",71e49b8c2c3df3be,Computational Biologists- Pharmacogenomics,,51.0,7,30+ days,2016-10-17 21:24:16.414864
305,"Chicago, IL",Civis Analytics,"Engineers collaborate across departments with our data scientists and analysts who are not only the best and brightest in their fields, but are also eager to...",2f376584be8197a7,Senior Software Engineer,,,,26 days,2016-10-17 21:24:16.414864
306,"Chicago, IL",Civis Analytics,"As a Software Engineer, you will join our Chicago-based technology team, working collaboratively with other engineers, analysts, and data scientists to serve...",1729bc1767f1af55,New Graduate - Software Engineer,,,,30+ days,2016-10-17 21:24:16.414864
307,"Chicago, IL",Civis Analytics,"The Product Design intern will join our Chicago-based product team, working collaboratively with engineers, data scientists, product managers, and other...",4efdea4229c4e130,Product Design Internship - Summer 2017,,,,30+ days,2016-10-17 21:24:16.414864
308,"Oakbrook Terrace, IL",Ferrara Candy Company,Works directly with Staff and Senior Scientists and sometimes directly with Marketing contacts on project execution and timelines....,a00c6590e35ade3a,Food Scientist,,40.8,21,2 days,2016-10-17 21:24:16.414864
309,"Chicago, IL",Publicis Healthcare Communications Group,"The Strategic Planning group works collaboratively with Account Management, Creative, Media, Advocacy, Scientific and Speaker Bureau team members, ensuring all...",a620519b38c51138,Engagement Strategist - Discovery USA,,,,30+ days,2016-10-17 21:24:16.414864
310,"Chicago, IL",NJF Search,"As such, the role involves developing novel machine learning techniques and applying them to seek patterns in large, dirty and noisy data sets....",c78d7c1271ac3b6e,Machine Learning Researcher,,,,30+ days,2016-10-17 21:24:16.414864
311,"Chicago, IL",National Opinion Research Center (NORC),"Since 1941, NORC has applied sophisticated methods and tools, innovative and cost-effective solutions, and the highest standards of scientific integrity and...",5c65082dbf691cf6,Senior Research Scientist - Public Health,,,,30+ days,2016-10-17 21:24:16.414864
312,"Chicago, IL 60604 (Loop area)",Motorola Solutions,The Data Scientist Team is located in the Chief Technology Organization of MSI. As a member of the data science team you will work with industry leaders to...,342fe1f655a01543,Software Engineer,,52.199997,1678,30+ days,2016-10-17 21:24:16.414864
313,"Skokie, IL",Fresenius Kabi,We currently have an opportunity for an Associate Scientist for Stability Formulation responsible for performing scientific functions to support formulation...,978d4f7fe8b275ea,"ASSOCIATE SCIENTIST, STABILITY FORMULATION (SK00102)",,44.4,68,6 days,2016-10-17 21:24:16.414864
314,"Abbott Park, IL",inVentiv Health Clinical,"Clinical Statistician II - C*. Expertise in predictive modeling, machine learning, and variety of classical statistical methods such as mixed-effects-models,...",4e790de260999b74,Clinical Statistician (Genomics and Biomarker),,43.8,52,30+ days,2016-10-17 21:24:16.414864
315,"Elk Grove Village, IL",Grecian Delight Foods Inc,Prioritizes project work load for all Meat NPD projects. The backup for this position is R&D Manager or R&D Scientist....,5f39f39d9e6223e4,Meat Food Scientist,,,,30+ days,2016-10-17 21:24:16.414864
316,"Chicago, IL",Morningstar,"The position is based in Chicago.ResponsibilitiesPlan, assign, write, edit, and manage content for Morningstar magazine.Ensure content is high quality, meets...",0de8e55aedb53604,Managing Editor,,43.8,45,24 days,2016-10-17 21:24:16.414864
317,"Chicago, IL",CDK Global,"From data scientists to sales and operations experts, we’re hiring to support your growth and ours - Green light your career ....",5746ace18ce55390,Digital Marketing Consultant III,,41.4,74,10 days,2016-10-17 21:24:16.414864
318,"Chicago, IL",Selby Jennings,3-5 years of experience with machine learning and big data analytics. They are looking to expand their Big Data analytics team with experienced quant...,b0908b2fe3ea1f5a,Quantitative Researcher – Big Data and Machine Learning,"$125,000 - $175,000 a year",,,30+ days,2016-10-17 21:24:16.414864
319,"Chicago, IL",Xaxis,"Xaxis combines proprietary technology, unique data assets and exclusive media relationships with the brightest team of audience analysts, data scientists and...",4bdfd3e2c285a692,Account Manager,,43.2,6,30+ days,2016-10-17 21:24:16.414864
320,"Chicago, IL",Workbridge Associates,"Mid, Senior, Lead, Data, Scientist, Machine, Learning, Predictive, Analytics, Engineer, Developer, Python, R, Hadoop, Hive, Impala, Spark, Storm, Pig,...",95a64b9d64637348,Natural Language Processing Scientist,"$145,000 a year",41.4,25,10 days,2016-10-17 21:24:16.414864
321,"Chicago, IL",SpotHero,"Applying data transformations, modeling, metric definitions, etc. on a streaming data pipeline to support real-time analytics....",a729747362b10c90,Senior Data Engineer,,,,30+ days,2016-10-17 21:24:16.414864
322,"Evanston, IL",NorthShore University HealthSystem,"Demonstrated success collaborating with clinical investigators or basic scientists. Performs statistical analyses for a variety of clinical research activities,...",590ab8136c6614c3,Sr. Biostatistician,,43.2,73,30+ days,2016-10-17 21:24:16.414864
323,"Chicago, IL",Civis Analytics,"Engineers collaborate across departments with our data scientists and analysts who are not only the best and brightest in their fields, but are also eager to...",8bd1aa650855f2ea,Front End Engineer (Senior/Associate),,,,18 days,2016-10-17 21:24:16.414864
324,"McCook, IL",Acro Service Corporation,Utilizes established mathematical and scientific techniques to compile and analyze data. Requires a bachelor degree and 0 - 4 years of experience in an...,93a90d3f9d2a1c76,Research & Development Engineer/ Scientist ACRO,,40.2,32,4 days,2016-10-17 21:24:16.414864
325,"Chicago, IL 60603 (Loop area)",Merkle Inc.,"The successful candidate will be able to display thought leadership, technical prowess, and the ability to manage cross-division, cross-functional teams from...",d9c4647708f91786,"Sr. Solution Developer, Senior Analyst",,42.0,2,30+ days,2016-10-17 21:24:16.414864
326,"Chicago, IL",Precision For Value,"At Precision, you will collaborate with teams that include former payers, data scientists, health economists, marketing strategists, and promotional...",350f0ad7588a4b4d,Assistant Account Executive - Medical Communications Job,,40.8,3,3 days,2016-10-17 21:24:16.414864
327,"Chicago, IL",dbHMS,Conduct quality assurance reviews to ensure engineering quality and accurate technical content of project documents....,86e23473cbc0bc57,Commissioning Engineer,,51.0,2,20 days,2016-10-17 21:24:16.414864
328,"Chicago, IL",University of Chicago,"The candidate will join an outstanding group of quantitative implementation scientists who apply state-of-the-art analytic methods to a broad range of research,...",aa70f3f268796c4f,Research Associate (Asst/Assoc/Prof) - Infectious Diseases (...,,52.800003,226,30+ days,2016-10-17 21:24:16.414864
329,"Chicago, IL",Morningstar,"R, MATLAB)Experience with data visualization is a plus (e.g. As a Senior Quantitative Analyst, you will lead the full research cycle including ideation, data...",6da99b56039b9277,Senior Quantitative Analyst,,43.8,45,30+ days,2016-10-17 21:24:16.414864
330,"Hillside, IL",Intertek,"ENVIRONMENTAL STAFF SCIENTIST. Report writing (including data summarization and tabulation). PSI, an Intertek company has an immediate search for a Staff...",4a970efbadddfb9b,Staff Scientist,,42.0,471,30+ days,2016-10-17 21:24:16.414864
331,"Downers Grove, IL",DeVry University,"The Data Scientist has a passion for analyzing data and through theory-based inquiry, hypothesis testing and process analytics, discover new insights and trends...",8a85d22d1638dc2b,Senior Manager Predictive Analytics,,43.8,720,30+ days,2016-10-17 21:24:16.414864
332,"Chicago, IL 60654 (Loop area)",Citizens United for Research in Epilepsy,"We identify and fund cutting-edge research, challenging scientists worldwide to collaborate and innovate in pursuit of this goal....",90e733935664cd79,Manager of Media Relations and Integrated Marketing,,,,12 days,2016-10-17 21:24:16.414864
333,"Chicago, IL",University of Chicago,"These scholars pursue this mission through research, the education of basic scientists, physicians, and others interested in living things, and through...",4500194704bed28b,MSTP Admin Dir for Admissions & Student Programs,,52.800003,226,12 days,2016-10-17 21:24:16.414864
334,"Chicago, IL",All-In Analytics,Looking for a seasoned manager very strong in machine learning and big data to build and lead a team of data scientists and engineers at a Fortune 100 company...,031bec76dd816a15,Head of Machine Learning Big Data,,,,30+ days,2016-10-17 21:24:16.414864
335,"Chicago, IL 60605 (Near South Side area)",TeamSoft,"More specifically, you would work closely with Data Scientists and other technical experts on data engineering initiatives to:....",5447cb0a3a156675,Data Engineer Developer / Data Scientist,,55.199997,3,6 days,2016-10-17 21:24:16.414864
336,"Deerfield, IL",BAXTER,"They play the role s of employee advocates, strategic business partners, change agents , and process experts, applying competencies in human capital planning,...",0a87e6f9deb8aa01,2016 National Black MBA Association Conference,,51.0,703,25 days,2016-10-17 21:24:16.414864
337,"Chicago, IL 60607 (Near West Side area)",eSpark,"The opportunity to work on a rare mixed and passionate team of experienced teachers, engineers, designers, and data scientists....",2c4e70b33d9309aa,Inbound Marketing Manager,,,,30+ days,2016-10-17 21:24:16.414864
338,"Chicago, IL",Civis Analytics,"At Civis Analytics, we're building a data science platform, making cutting-edge machine learning and predictive modeling techniques available to a broad...",6c20bbb3a3876163,Senior Engineer - Site Reliability,,,,27 days,2016-10-17 21:24:16.414864
339,"Evanston, IL",Jobspring Partners,"Vice President, Analytics, Downtown, SQL, BI Tools, VBA, Python, Java, Agile Methodologies, Data Science, Data Engineer, Marketing Analytics, Data Scientist,...",7c51651b70cda69d,VP of Analytics (Deep Learning),"$160,000 - $180,000 a year",40.8,12,30+ days,2016-10-17 21:24:16.414864
340,"Chicago, IL",University of Chicago,"These scholars pursue this mission through research, the education of basic scientists, physicians, and others interested in living things, and through...",7e61f5c388105e1e,Budget Director,,52.800003,226,12 days,2016-10-17 21:24:16.414864
341,"Chicago, IL",Food Management Search,"Salary $75 - $95K, Health, 401k matching,. Data, drawing conclusions, documenting,. A technical leadership role providing direction....",6d1ffb87eef42c61,Food Scientist MS or PhD - Meat Products,"$75,000 - $95,000 a year",,,30+ days,2016-10-17 21:24:16.414864
342,"Chicago, IL",University of Chicago,"These scholars pursue this mission through research, the education of basic scientists, physicians, and others interested in living things, and through...",e00920f027b6a3e7,Finance Analyst,,52.800003,226,23 days,2016-10-17 21:24:16.414864
343,"Chicago, IL 60654 (Loop area)",Tempus,"PhD in clinical laboratory science, chemical, physical or biological science and 3 years of experience in high-complexity clinical cytogenomics....",d881387adf77273c,Senior Scientist I - Clinical NGS,,51.0,7,17 days,2016-10-17 21:24:16.414864
344,"Chicago, IL",The CSI Companies,Assist Associate Director and Director of Analytics in the identification and quantification of applications of analytics and development of project charters...,7f9dd9179d72d4fb,Principal Statistical Analyst - Retail Group,,40.8,40,12 days,2016-10-17 21:24:16.414864
345,"Chicago, IL",CURE,"We identify and fund cutting-edge research, challenging scientists worldwide to collaborate and innovate in pursuit of this goal....",7d8e326c8d6221b4,"MANAGER, SPECIAL EVENTS & COMMUNITY ENGAGEMENT",,43.8,11,17 days,2016-10-17 21:24:16.414864
346,"Dolton, IL 60419",,"I'm trying to become a data analyst or data scientist. R Tutoring & Teaching opportunities available in Dolton, IL starting at $25-$50/hr....",ecfc5f96cac02488,R Tutor/Teacher,$24 - $30 an hour,,,26 days,2016-10-17 21:24:16.414864
347,"Chicago, IL",PepsiCo,"Able to manage multiple projects, priorities, and deadlines. Effectively applies data analysis tools (e.g., spreadsheets, Accolade) to maximize efficiency....",44c3547c03c68b51,Senior Innovation Scientist,,44.4,5094,30+ days,2016-10-17 21:24:16.414864
348,"Chicago, IL 60606 (Loop area)",Parsons Corporation,"This position will report to a senior environmental engineer/project manager and will work with various engineers, scientists, administrative and safety...",4dfb8bb13bec2ae1,Associate Civil or Environmental Engineer - Whiting Refinery...,,43.8,267,24 days,2016-10-17 21:24:16.414864
349,"Skokie, IL",Charles River,"O Interacts with external data management groups/clients regarding DIAs, data release etc. o Aids in the review/generation of DIAs associated with data release...",d8e1658872c4348f,Project Specialist,,41.4,33,13 days,2016-10-17 21:24:16.414864
350,"Chicago, IL",The Climate Corporation,"You will have the opportunity to work with large, ""big data"" sets such as scientific data, machine generated data from our farmer's equipment, geospatial data,...",f83d36047863d9af,"Staff Software Engineer, Backend",,54.0,2,30+ days,2016-10-17 21:24:16.414864
351,"Abbott Park, IL",Metabyte Inc,"The major responsibilities include conducting experiments, summarizing data, presenting data within the team, recommending options for other experiments, and...",8aeac64bc17bfe7b,Associate Scientist I,,,,30+ days,2016-10-17 21:24:16.414864
352,"Chicago, IL",NCSA Athletic Recruiting,Partner with business owners and data scientists to better deliver data to register users. Online Health Assessments....,c83c3bab77aa7ac0,Senior Ruby Developer,,42.6,14,14 days,2016-10-17 21:24:16.414864
353,"Chicago, IL",Cook County Health & Hospitals System,Qualified as an Medical Technologist as defined by the Illinois Clinical Laboratories Code and Clinical Laboratory Improvement Amendments (CLIA) (....,043acd8080efc94a,MEDICAL TECHNOLOGIST III,$27.61 an hour,52.800003,8,26 days,2016-10-17 21:24:16.414864
354,"Skokie, IL 60077",Sg2,"Sg2, a Vizient company, provides analytics-based health care expertise to help hospitals and health systems integrate, prioritize and drive growth and...",79eaa36fbc952204,Research Associate (Patient Flow Analyst),,,,30+ days,2016-10-17 21:24:16.414864
