,location,company,summary,jkid,title,salary,stars,reviews,post_date,pull_date
0,"Chicago, IL",Brad's Deals,Brad’s Deals is looking for an experienced data scientist to join our team. Develop recommender systems based on behavioral data....,4345e7fc5772b24a,Data Scientist,,,,1 day,2016-10-17 21:24:16.414864
1,"Chicago, IL","Vizient, Inc.","Serves as the resident data expert and share best practices/approaches for statistics, machine learning techniques, data modeling, simulation and advanced...",9a441b69e587736a,Data Scientist,,,,4 days,2016-10-17 21:24:16.414864
2,"Chicago, IL",Anomalix,Data Scientist Responsibilities will include:. Anomalix is looking for strong data scientist candidates to join a team building out our flagship enterprise...,711c408ec28cfcaf,Data Scientist,,,,11 days,2016-10-17 21:24:16.414864
3,"Chicago, IL",BMW Technology Corporation,"Develop novel and useful machine learning and data mining techniques, as well as assess 3rd party machine learning and data mining components....",12c756d844582814,Machine Learning Researcher - BMW Technology Corporation,,,,8 days,2016-10-17 21:24:16.414864
4,"Chicago, IL 60601 (Loop area)",KPMG,"Machine learning, data visualization, statistical modeling, data mining, or information retrieval. KPMG is currently seeking a Data Scientist, to join our...",470c8353e5469a5b,Data Scientist,,51.0,1768,3 days,2016-10-17 21:24:16.414864
5,"Chicago, IL",Amyx,"Seeking a Senior Data Scientist with experience and knowledge of analytics to solve large-scale, enterprise, complex, and challenging business problems....",3e0070b7e8dc8931,Data Scientist,,,,14 days,2016-10-17 21:24:16.414864
6,"Chicago, IL",Google,Experience with data analytics and/or data visualization techniques and software. Experience interpreting technical data and creating reports with data....,f94835ba16f9ce1d,"Machine Learning Deployment Engineer, Professional Services,...",,52.800003,1219,17 days,2016-10-17 21:24:16.414864
7,"Chicago, IL 60606 (Loop area)",ZirMed,"The role will focus on extending machine learning, predictive modeling and data mining components to provide up-to-date intelligence to healthcare providers...",28c603e910a47aed,Data Scientist,,51.0,5,19 days,2016-10-17 21:24:16.414864
8,"Chicago, IL",National Opinion Research Center (NORC),Working knowledge of applied survey sampling and statistics for all modes of social science data collection....,58c12518a1e9f17b,Statistician,,,,4 days,2016-10-17 21:24:16.414864
9,"Chicago, IL 60654 (Loop area)",RAY ALLEN,"Use Qlik Sense along with Excel, Access, MySQL, R, and other tools to clean up, organize, model (ETL), and interpret large data sets....",3a982c164ab623ef,Associate Data Scientist,,,,14 days,2016-10-17 21:24:16.414864
10,"Chicago, IL",Ipsos North America,"DAAS is a team of statisticians, social scientists, and data specialists based in our Washington DC and Chicago IL offices who develop customized, high quality...",a43b889603b867af,USPA - Statistical Programmer,,42.6,185,2 days,2016-10-17 21:24:16.414864
11,"Chicago, IL",Kaplan,Metis Senior Data Scientists provide incredible and inspiring Data Science instruction; We are looking for Senior Data Scientists to be part of the Metis Data...,0e3e273b124515ba,Senior Data Scientist,,43.2,948,5 days,2016-10-17 21:24:16.414864
12,"Chicago, IL",Kelton Global,"One to two years of relevant quantitative experience within a market research capacity is highly preferred, but if you have relevant internship experience, we...",fc418bb64af01726,"Analyst, Quantitative Research",,,,6 days,2016-10-17 21:24:16.414864
13,"Chicago, IL 60654 (Loop area)",CCC Information Services Inc.,"The Vision Scientist, will contribute to a photo analytics project, with a goal of developing a fully automated solution for an auto collision damage appraisal....",f2657a697ef8921c,Computer Vision Data Scientist,,42.6,28,6 hours,2016-10-17 21:24:16.414864
14,"Chicago, IL",Civis Analytics,"With a specialization in unstructured data, this Data Scientist role will apply techniques from fields such as machine learning, applied statistics, natural...",216f8383df42ee69,Data Scientist - Unstructured Data,,,,27 days,2016-10-17 21:24:16.414864
15,"Chicago, IL 60603 (Loop area)",Raise Marketplace Inc.,Manage incoming ad-hoc reporting requests and data related inquiries. Experience with online testing web analytics and testing platform is a plus (Google...,09f54ef997ccf9c3,Data Analyst,,,,9 days,2016-10-17 21:24:16.414864
16,"Chicago, IL",Northwestern University,"Ensures data integrity. This includes database administration, data consolidation, data analysis and management reporting....",a4c3ff922a8230f3,Statistical Analyst,,52.199997,174,12 days,2016-10-17 21:24:16.414864
17,"Chicago, IL",Northwestern University,"Critical thinking, business intelligence application design, data mining, data modeling, data warehouse design/develop, database design/ data structure,...",11753ea285fae197,Senior Statistical Analyst,,52.199997,174,10 days,2016-10-17 21:24:16.414864
18,"Deerfield, IL",Photon,"Experience in Machine Learning Techniques, Statistical Analysis and Modelling, Big Data Analytics, Advanced Visualization, Data Science, Statistical Computation...",bf6ea203264e9da8,Data Scientist,,42.6,5,13 days,2016-10-17 21:24:16.414864
19,"Chicago, IL 60604 (Loop area)",Wolverine Trading,"Machine Learning Data Scientist. Masters or PhD in Statistics, Physics, Applied Mathematics Computer Science/Machine Learning, or other highly quantitative...",4b77ac5b55eefbce,Machine Learning Data Scientist,,,,27 days,2016-10-17 21:24:16.414864
20,"Chicago, IL",Valence Health,"Leveraging 20 years of experience, Valence Health works with clients to design, build and manage customized value-based care models including clinically...",31a10e2ccf371306,Data Scientist,,,,30 days,2016-10-17 21:24:16.414864
21,"Chicago, IL",National Opinion Research Center (NORC),"At NORC, Data Scientists play a strategic role in supporting our research teams to produce valuable insights for our clients....",06f04cfbf04d503d,Data Scientist,,,,30+ days,2016-10-17 21:24:16.414864
22,"Chicago, IL 60654 (Loop area)",The Boston Consulting Group,"Data Engineers, together with Data Scientists, Scientific Modelers, Scientific Programmers, Data Visualization Specialists as well Geospatial Analysts, are the...",f2682a47507714ef,Knowledge Analyst - Data Engineering,,52.199997,58,10 days,2016-10-17 21:24:16.414864
23,"Chicago, IL",Capital One,Creating machine learning models from development through testing and validation to our 100+ million customers in production....,ee0f4a9e966a4f24,Data Science Manager,,44.4,2904,17 days,2016-10-17 21:24:16.414864
24,"Chicago, IL",BMO Financial Group,Detailed knowledge of data analysis / analytics / mining techniques. Data Mining & Modeling In-depth. Perform analysis using statistical tools (SAS & SQL) to...,59ac4e0c724c539e,"Statistical Modeller, AML Model Development",,43.2,465,5 days,2016-10-17 21:24:16.414864
25,"Chicago, IL",Precima,Precima applies shopper insights derived from advanced analytics to help retailers and manufacturers drive sales growth and boost profitability....,dfb147b84568b8ec,Data Scientist,,,,30+ days,2016-10-17 21:24:16.414864
26,"Chicago, IL 60647 (Logan Square area)",The Nielsen Company,Work with Data Scientists to automate and implement advanced analytical models. We need a talented developer to help us design and build the services that will...,e03f852adf4b64c1,Big Data Engineer (Python),,43.2,676,12 hours,2016-10-17 21:24:16.414864
27,"Downers Grove, IL",Dupage Medical Group,"MPAS was created in 2011 to provide an efficient way of integrating and delivering administrative and clinical services to customers like Northwestern Medicine,...",1b54efb6b0ab5ee2,Data Scientist-Analytics,,39.0,71,11 days,2016-10-17 21:24:16.414864
28,"Chicago, IL",e.biT,"Computational statistics/science/engineering, data mining, machine learning, and optimization. Act as an expert and evangelist in areas of data mining, machine...",1fedc4d6d8866e76,Principal Data Scientist - 16-00217,,,,3 days,2016-10-17 21:24:16.414864
29,"Chicago, IL",UnitedHealth Group,"The Healthcare Data Scientist is responsible for participating in the full array of analytics, clinical analytic consulting and applied analytic activities at...",13cf7d9c399a4fe3,"Senior Research Consultant (Data Scientist) - Chicago, IL",,43.2,4187,5 days,2016-10-17 21:24:16.414864
30,"Chicago, IL",Capgemini,"5+ years of leading large, global teams of data scientists in an Analytics Services business. At least 5 years of leading large, global teams of data scientists...",9ac6da4943d4cb08,Vice President - Global Digital-Analytics,,43.8,2002,30+ days,2016-10-17 21:24:16.414864
31,"Chicago, IL",General Assembly,"You are eager to shape the skills, minds, and trajectories of the newest generation of data scientists. Data visualization techniques;...",18daa6de0b68dd8b,Part-time Data Science Instructor,,52.800003,74,14 days,2016-10-17 21:24:16.414864
32,"Chicago, IL",Jobspring Partners,This role is ideal for someone who has a strong passion for analytics and has worked with multiple Machine Learning frameworks such as Spark and Scikit-learn....,c5db4652c8b8c201,Machine Learning Engineer,"$100,000 - $120,000 a year",40.8,12,12 days,2016-10-17 21:24:16.414864
33,"Chicago, IL",Civis Analytics,"Applied Data Scientists collaborate with clients, Civis Analytics’ R&D and Technology teams, and managers to leverage cutting-edge statistical techniques,...",1700bb8d9ccad48b,Applied Data Science Internship - Summer 2017,,,,30+ days,2016-10-17 21:24:16.414864
34,"Chicago, IL",HERE,"Data mining, machine learning, and optimization. Solutions and organizing teams of other data scientists and engineers to....",1636eef60b3362f7,Principal Data Scientist,,43.8,56,11 days,2016-10-17 21:24:16.414864
35,"Chicago, IL 60611 (Near North Side area)",Enterprise Consulting Services,"Computational statistics/science, data mining, machine learning, and optimization. This role will entail the design and prototyping of data analysis products...",d78ca35e927a3159,Data Scientist,,60.0,3,8 days,2016-10-17 21:24:16.414864
36,"Chicago, IL",Illinois Technology Association,Data Scientist -Speech Recognition. Creating machine learning models from development through testing and validation to our 30+ million customers in production....,baee34550151a7a8,Capital One - Data Scientist -Speech Recognition,,,,24 days,2016-10-17 21:24:16.414864
37,"Chicago, IL 60601 (Loop area)",KPMG,"Utilize analytics to explore data, and identify key trends and insights from multi-faceted, and high-dimensional data, and work with data scientists to create...",f11203a0af762b65,Data Visualization Software Engineer,,51.0,1768,3 days,2016-10-17 21:24:16.414864
38,"Chicago, IL 60601 (Loop area)",LoyaltyOne,Precima applies shopper insights derived from advanced analytics to help retailers and manufacturers drive sales growth and boost profitability....,9b9b2138f4e56936,Data Scientist,,39.0,30,30+ days,2016-10-17 21:24:16.414864
39,"Chicago, IL",Northwestern University,"Critical thinking, data mining, data modeling, data warehouse design/develop, database design/ data structure, decision making, judgment, problem solving,...",9930a920e3dc86fc,Research Data Analyst,,52.199997,174,13 days,2016-10-17 21:24:16.414864
40,"Chicago, IL",Hirewell,"Expertise in text mining, NLP methods, information extraction and/or machine learning. Bring structure to large quantities of data - turn unstructured data into...",a7ac79993371379d,Data Scientist -Fitness/Wellness Firm,"$120,000 a year",,,10 days,2016-10-17 21:24:16.414864
41,"Chicago, IL",McKinsey & Company,"3+ years of deep technical experience in distributed computing, machine learning, and statistics related work within the mining & metals industry....",3d52cef7eaf36f3f,Data Scientist – Metals & Mining,,52.800003,169,30+ days,2016-10-17 21:24:16.414864
42,"Chicago, IL","University of Chicago, Center for Data Intensive S","Our scientific data clouds and commons include the Genomic Data Commons, Bionimbus Protected Data Cloud, and Open Science Data Cloud....",a22744a8a21caa4d,Data Quality Engineer,,,,27 days,2016-10-17 21:24:16.414864
43,"Chicago, IL","Eldorado Trading, LLC","Market Data and Order Management System Experience preferred. Solid with data structures, STL algorithms, C++ templates and some experience with system...",bcb8eec723dc941d,Quantitative Analyst Intern,,,,3 days,2016-10-17 21:24:16.414864
44,"Chicago, IL",JPMorgan Chase,"The Data Scientist will design, execute, and interpret statistical analyses to drive insights and strategy. VP, Data Scientist - Credit Risk Operational Metrics...",a9b1907287da0398,"VP, Data Scientist - Credit Risk Operational Metrics",,44.4,10704,30+ days,2016-10-17 21:24:16.414864
45,"Chicago, IL 60601 (Loop area)",KPMG,"Machine learning, data visualization, statistical modeling, data mining, or information retrieval. Five years of professional experience working as a Data...",6ebc52bfd98b9c19,Sr Associate - Data Scientist,,51.0,1768,25 days,2016-10-17 21:24:16.414864
46,"Chicago, IL 60642 (Portage Park area)",National Collegiate Scouting Association,"Senior Data Scientist. Visualization scripting (D3, Highcharts, R Shiny, etc.). You are a Scientist:. Machine Learning methodologies....",d11275530251a6f0,Senior Data Scientist,,39.6,8,26 days,2016-10-17 21:24:16.414864
47,"Chicago, IL",Civis Analytics,We’re looking for recent undergraduate or postgraduates with experience applying state-of-the-art statistical methods and tackling computational and programming...,cb86f3205f73582a,New Graduate - Data Scientist,,,,30+ days,2016-10-17 21:24:16.414864
48,"Chicago, IL 60601 (Loop area)",Prosperoware,"Experience with data mining, machine learning, statistical modeling tools and underlying algorithms. Search for data sets matching data analytics requirements....",10b397794e6363ed,Data Scientist,,55.199997,3,30+ days,2016-10-17 21:24:16.414864
49,"Chicago, IL",National Opinion Research Center (NORC),"Since 1941, NORC has applied sophisticated methods and tools, innovative and cost-effective solutions, and the highest standards of scientific integrity and...",458d6f526c9a7f19,Senior Statistician,,,,4 days,2016-10-17 21:24:16.414864
50,"Chicago, IL",University of Chicago,"The Open Science Data Cloud (OSDC) provides the scientific community with resources for storing, sharing, and analyzing terabyte- and petabyte-scale scientific...",59d530627185752b,Data Quality Engineer,,52.800003,226,23 days,2016-10-17 21:24:16.414864
51,"Chicago, IL",Illinois Technology Association,Integrating with external data sources and APIs to discover interesting trends (NOAA Weather Data + Credit Card Transactions = Fascinating!)....,16731f95b73d209a,Capital One - Data Scientist,,,,24 days,2016-10-17 21:24:16.414864
52,"Chicago, IL 60654 (Loop area)",Echo Global Logistics,"Reporting to the Principal Data Scientist, this role uses statistical and analytic techniques, including descriptive and predictive modeling, machine learning,...",09002b7b975e2d57,Associate Data Scientist,,41.4,80,30+ days,2016-10-17 21:24:16.414864
53,"Chicago, IL 60654 (Loop area)",Trunk Club,Helping data scientists develop algorithms in our relevance and recommender systems; Mentoring junior data scientists in understanding the basis for various...,88016542c62157ea,Director of Data Science,,42.0,37,14 days,2016-10-17 21:24:16.414864
54,"Chicago, IL 60654 (Loop area)",CCC Information Services Inc.,Data Scientist / Statistician. Is seeking a Data Scientist / Statistician to work on the Data Science team to turn data insights into business recommendations....,6b05a28a6a7c89f0,Data Scientist / Statistician,,42.6,28,30+ days,2016-10-17 21:24:16.414864
55,"Chicago, IL",Workbridge Associates,A well-respected healthcare corporation that spun off of a major hospital and university is hiring for a Mid-Level Data Scientist to join their fast growing...,d4e26ad650ab85c4,Data Scientist,"$80,000 - $110,000 a year",41.4,25,17 days,2016-10-17 21:24:16.414864
56,"Chicago, IL 60614 (Lincoln Park area)",MAKE Corporation,"Identifying opportunities to innovate on top of the CLS data, which promote skills in Data Analytics. The initial focus for this role will be to deliver a...",2f4671c22c24973d,Data Scientist,,,,25 days,2016-10-17 21:24:16.414864
57,"Chicago, IL",Willis Towers Watson,"Building upon our existing advanced analytics and data provisions services, RCS is currently broadening its big data predictive analytics capabilities and is...",a6b03cd8999defc9,Data Analytics Manager,,44.4,217,9 days,2016-10-17 21:24:16.414864
58,"Chicago, IL","Blue Cross Blue Shield of IL, MT, NM, OK & TX","Experience in leading and mentoring data scientists. Knowledge in optimal computational environment required for data processing, mining and machine learning...",0bf1247fb3a27f98,"Manager, Data Science",,51.0,3388,7 days,2016-10-17 21:24:16.414864
59,"Chicago, IL",Optiver,Data Scientists and Quantitative Researchers. Optiver is looking for Data Scientists and Quantitative Researchers to join our Chicago Office....,dfa37ba3b0f7904e,Data Scientists and Quantitative Researchers,,43.8,4,30+ days,2016-10-17 21:24:16.414864
60,"Chicago, IL",IRI,"Our R&D team is expanding and looking for the right person to work with other data scientists, product managers, and technology teams to develop new and...",0f43798fe7b0da9b,R&D Data Science Consultant,,43.8,6,30+ days,2016-10-17 21:24:16.414864
61,"Chicago, IL",Iris Mobile,Develop machine learning models to better process our data. 3-5 years of experience working in a business intelligence or data analytics capacity....,45d7543074d40ed0,Data Scientist,,,,30+ days,2016-10-17 21:24:16.414864
62,"Chicago, IL",American Family Insurance,"American Family’s Data Science and Analytics Lab (DSAL) is charged with using advanced analytical techniques – including machine learning, natural language...",838d24021a9db5a1,Data Science Student Internship,,43.2,512,23 days,2016-10-17 21:24:16.414864
63,"Chicago, IL",National Opinion Research Center (NORC),"Trains, mentors, and supervises other data analysts and lesser skilled data scientists. At NORC, Senior Data Scientists play a strategic role in working with...",f2370dfa6bd27f61,Senior Data Scientist,,,,30+ days,2016-10-17 21:24:16.414864
64,"Chicago, IL",University of Chicago,"Will be involved in project monitoring and evaluation, data analysis and dissemination of program results. Strong knowledge of program subject matter....",ed67bb0f10fd7f1e,Research Data Analyst,,52.800003,226,5 days,2016-10-17 21:24:16.414864
65,"Chicago, IL",University of Chicago,"Manage projects with stakeholders to analyze needs, define business requirements and priorities, research and identify solutions, ensure achievement of project...",b83c062306832593,"Exec Dir, Strategic Analytics & Data Intelligence",,52.800003,226,10 days,2016-10-17 21:24:16.414864
66,"Chicago, IL",VitalSource Staffing,They need talented engineers and data scientists to help build the next generation of advertising and marketing technology using the latest tactics in Machine...,2e9eef32956cd1f2,Data Scientist - Multiple Roles Available,,,,30+ days,2016-10-17 21:24:16.414864
67,"Chicago, IL",Solving IT,"Expertise in areas of data mining such as topic modeling, natural language processing, and machine learning (preferred)....",4deed9fabf13b3fe,Data Scientist 22086,,,,6 days,2016-10-17 21:24:16.414864
68,"Chicago, IL",Workbridge Associates,"A leading provider of healthcare analytics for hospitals, health systems and physicians is looking to grow out their clinical analytics team by adding a Data...",fe0c6e50090d5817,Data Scientist (Healthcare Data),"$110,000 a year",41.4,25,30+ days,2016-10-17 21:24:16.414864
69,"Chicago, IL",IRI,"Investigate and resolve client production data issues. The IRI Analytics Research & Development group is responsible for defining, understanding and maintaining...",9330b883036df3a6,Statistical Analyst,,43.8,6,30+ days,2016-10-17 21:24:16.414864
70,"Chicago, IL 60661 (Near West Side area)",Orbitz,SEM Data Scientist. Support our Search Science projects using Text Analytics and Machine Learning techniques....,a4da2514ebf34afe,SEM Data Scientist,,52.199997,30,30+ days,2016-10-17 21:24:16.414864
71,"Chicago, IL",BMO Financial Group,Participate on projects and act as a subject matter exert to ensure financial information is reported completely and accurately....,d1fd4209d54d615f,Quantitative Analyst,,43.2,465,14 days,2016-10-17 21:24:16.414864
72,"Chicago, IL",Google,"The Google Cloud training team already develops and delivers Google Cloud Platform product and solution training to thousands of partners, end-users and...",ad855caf868f401a,"Cloud Instructor (Big Data, Machine Learning), Google Cloud...",,52.800003,1219,17 days,2016-10-17 21:24:16.414864
73,"Chicago, IL",Illinois Technology Association,Principal Data Scientist. At least 3 years’ experience with machine learning. Integrating with external data sources and APIs to discover interesting trends....,7cfcfff3bcf4cd12,Capital One - Principal Data Scientist,,,,4 hours,2016-10-17 21:24:16.414864
74,"Chicago, IL",Civis Analytics,"Applied data scientists structure hard problems, analyze large data sets, build predictive models, collaborate in cross-functional teams, create client...",92442317ab080b73,New Graduate - Applied Data Scientist,,,,30+ days,2016-10-17 21:24:16.414864
75,"Des Plaines, IL",ABBOTT LABORATORIES,"Applies the results of reviews of literature, patents, and current practices relevant to the solution of current problems....",68b0ed3f2c98559c,Statistical Data Analyst / Programmer,,52.199997,1279,17 days,2016-10-17 21:24:16.414864
76,"Chicago, IL",Metropolitan Water Reclamation District of Greater...,"Appointment is subject to successfully passing a physical examination, a drug test, and a criminal history background investigation....",2fe08debb27ff717,Senior Environmental Soil Scientist,"$93,257 - $137,114 a year",51.0,7,3 days,2016-10-17 21:24:16.414864
77,"Chicago, IL 60290 (Loop area)",Market Track,"Review and analyze data; Strong interest in data analysis. Today more than 1,700 clients, including 75 of the nation's top 100 advertisers, as well as global...",748e94e75bad188b,Entry-level Market Research Analyst,,41.4,5,24 days,2016-10-17 21:24:16.414864
78,"Chicago, IL 60613 (Uptown area)",Empowered Staffing,"Structure current data into Data Warehouse | Data through acquisitions. 2-5+ years with data engineering, data science or data analysis in eCommerce or Medical...",51e5d068a38d9b22,Data Scientist | eCommerce & Analytics,,,,26 days,2016-10-17 21:24:16.414864
79,"Chicago, IL",University of Chicago,Advanced knowledge in relevant scientific field required. Perform data processing and quality control for genetic and genomic data....,8a97769135997846,Research Professional Data Analyst,,52.800003,226,16 days,2016-10-17 21:24:16.414864
80,"Chicago, IL",Federal Reserve Bank of Chicago,"This position is responsible for modeling complex business problems, discovering unique business insights, and creating innovative solutions with the use of...",f84ed5fb01a86590,Data Scientist,,51.6,314,30+ days,2016-10-17 21:24:16.414864
81,"Chicago, IL",GinasTechJobs.com,"Chicago IL Jobs, Quantitative Research Analyst, Python, SQL, Linux, UNIX, R, MatLab, Financial, Chicago Recruiters, IT Jobs, Chicago Recruiting....",177652ba81fd1e47,Quantitative Research Analyst,"$180,000 a year",,,3 days,2016-10-17 21:24:16.414864
82,"Chicago, IL",Klein Hersh International,"At least 5 years’ experience in applying advanced analytic methods to diverse large data sets to derive valuable insights, predictions and performance measures....",0d9fe3dc747eb74a,Data Scientist,,,,26 days,2016-10-17 21:24:16.414864
83,"Chicago, IL",InContext Solutions,"Are you passionate about mining insights from large amounts of data? You have a keen desire to solve business problems, and live to find patterns and insights...",241138222a9fc6ab,Lead Data Scientist,,,,26 days,2016-10-17 21:24:16.414864
84,"Chicago, IL",T3 Trading Group LLC,"If you have a strong analytical and statistical background along with current market experience, please send an updated resume to discuss a potential career...",7af6886986e546ce,Statistical Pairs Trading Position,,51.0,4,23 days,2016-10-17 21:24:16.414864
85,"Chicago, IL",Capital One,Data Scientist -Speech Recognition. Creating machine learning models from development through testing and validation to our 30+ million customers in production....,fd3454e320fd7986,Data Scientist -Speech Recognition,,44.4,2904,30+ days,2016-10-17 21:24:16.414864
86,"Chicago, IL",HERE,"Trends in the data and presents them to other scientists and business managers. Computational statistics/science, data mining, machine learning, and...",26f7d0f10d32faaa,Production Data Scientist,,43.8,56,30+ days,2016-10-17 21:24:16.414864
87,"Chicago, IL","Envestnet Asset Management, Inc","The candidate has to be knowledgeable in his core subject (e.g., statistics, econometrics, computation, programming), intelligent, creative, hard-working, and...",429e3a647532e71c,Quantitative Research Analyst,,,,30+ days,2016-10-17 21:24:16.414864
88,"Chicago, IL",Capital One,Integrating with external data sources and APIs to discover interesting trends (NOAA Weather Data + Credit Card Transactions = Fascinating!)....,2a6f51db62b3f6cb,Data Scientist,,44.4,2904,30+ days,2016-10-17 21:24:16.414864
89,"Chicago, IL",Metropolitan Water Reclamation District of Greater...,"Appointment is subject to successfully passing a physical examination, a drug test, and a criminal history background investigation....",c05a9b9df803df10,Supervising Environmental Soil Scientist,"$104,674 - $151,358 a year",51.0,7,3 days,2016-10-17 21:24:16.414864
