,location,company,summary,jkid,title,salary,stars,reviews,post_date,pull_date
0,"New York, NY 10003 (Greenwich Village area)",The Nielsen Company,"Minimum of 3+ years relevant analytics and data mining & modeling work experience, with a particular stress on supervised learning....",11b2c6106873140f,Data Scientist,,43.2,676,12 hours,2016-10-17 21:29:15.887221
1,"New York, NY",Barclays,"Or Master’s Degree in operations research, applied statistics, data mining, machine learning, physics or a related quantitative discipline....",da51764d46d036c7,Data Scientist,,51.0,2189,4 days,2016-10-17 21:29:15.887221
2,"New York, NY 10014 (West Village area)",Squarespace,"Impressive skill with a major programming language (Python, C++, Java) and/or analytics tool (Pandas, R, SQL, Excel), preferably both....",720492247ff1279e,Data Scientist,,55.199997,15,3 days,2016-10-17 21:29:15.887221
3,Remote,Fractl,"Fluency in a statistical programming language, like R or Python, and a database querying language like SQL. We’re looking for a Data Scientist who can reveal...",c7c6c83897704934,Freelance Data Scientist,,51.0,4,6 days,2016-10-17 21:29:15.887221
4,"New York, NY 10032 (Washington Heights area)",Morgan Stanley,The Modeling team and other MSSM project based teams such as Core Analytics and Core Electronic Trading provide quantitative solutions to multiple....,fe65822ddca4a793,Data Scientist / Modeler,,44.4,1523,7 days,2016-10-17 21:29:15.887221
5,"Orangeburg, NY 10962",Verizon,"Knowledge of machine learning, natural language processing, text analytics, regression modeling and statistical analysis methods....",c72f711f3cde8fee,Data Scientist - Entry Level,,44.4,11117,6 days,2016-10-17 21:29:15.887221
6,"New York, NY",NBCUniversal,"Experience in handling large data sets, combining data from different sources, data analysis, reporting and insight generation....",3e7a055f247bd8a1,"Data Scientist, Pricing & Yield",,51.6,980,4 days,2016-10-17 21:29:15.887221
7,"New York, NY 10003 (Greenwich Village area)",Verizon,"Familiarity and experience with creating analytical data sets. Master’s Degree in Statistics, Math, Economics, Engineering, Computer Science, Business Analytics...",cdb4ec912f0a7ad7,Data Scientist,,44.4,11117,7 days,2016-10-17 21:29:15.887221
8,"New York, NY",Quovo,"We're looking for developers to expand a data pipeline that spans from retrieval to mining, machine learning and visualization....",d440cf741745f761,Data Scientist,,,,3 days,2016-10-17 21:29:15.887221
9,"Phoenix, AZ",Honeywell,"Developing overall strategy for Big Data Analytics, including Analytics Tiger. Product Data Utilization:. Strong in data interpretation....",d23cafb01669f713,Data Scientist II,,44.4,3477,3 days,2016-10-17 21:29:15.887221
10,"New York, NY",WebMD,"Medscape, a division of WebMD, develops and hosts physician portals and related mobile applications that make it easier for physicians and healthcare...",dc83aef5bd9a2b7f,Data Scientist,,42.6,79,5 days,2016-10-17 21:29:15.887221
11,"New York, NY",PlaceIQ,"A mixture of analytical approaches are employed including raw data mining, data visualization, application of rules and heuristics and supervised / unsupervised...",fb8776d2079bed6d,Data Scientist,,55.199997,3,1 day,2016-10-17 21:29:15.887221
12,"New York, NY 10003 (Greenwich Village area)",SoundCloud,"We’re looking for Data Scientists to join our Data Science team to help us make data-informed decisions across a number of areas in our organization, including...",c5d8b2c107ddc05c,"Data Scientist, Analytics",,,,12 days,2016-10-17 21:29:15.887221
13,"New York, NY",Dataiku,"Familiarity with data visualization in R or Javascript. Our ideal candidate is comfortable learning new languages, technologies and modeling techniques, while...",27d9f7a620783cde,Data Scientist - USA,,,,11 days,2016-10-17 21:29:15.887221
14,"New York, NY 10006 (Financial District area)","Syntel Inc.,","Senior Data Scientist. Developing data validation methods. This is Full time position with Syntel Inc., including Health and Relocation benefits*....",847cb6747ddc8da6,Data Scientist,,42.6,738,12 days,2016-10-17 21:29:15.887221
15,"New York, NY",Amazon Corporate LLC,Leading in Machine Learning requires the best scientists in the world. The Amazon Web Services (AWS) Machine Learning group is looking for scientists to join...,35dd73ab66d04b0b,Data Scientist,,43.2,9618,17 days,2016-10-17 21:29:15.887221
16,"New York, NY",MediaMath,"Rapidly develop a deep understanding of the quantitative methodologies and implementation details behind existing machine learning algorithms in place, and the...",207734dbdc73cf54,Data Scientist II,,40.2,9,7 days,2016-10-17 21:29:15.887221
17,"San Carlos, CA",Upstart,"This individual will have a tremendous impact on our ability to attract new users and scale our business, and will also have the chance to collaborate cross...",31975e74bcc7ca3d,Growth Data Scientist,,51.0,3,5 days,2016-10-17 21:29:15.887221
18,"New York, NY",Dia&Co,"Dives deep into problems to truly understand them before approaching a solution. Python, R, Matlab, SQL). In a relevant field, with knowledge of statistics,...",0c7191b9aa41f699,Data Scientist,,,,11 days,2016-10-17 21:29:15.887221
19,"Syracuse, NY 13202 (Southwest area)","SRC, Inc.","Master's degree in electrical engineering, computer engineering, math, physics, computer vision, or machine learning (preferably deep learning)....",221e9810c76f4c75,Data Scientist /Systems Engineer (Machine Learning),,42.0,2,2 days,2016-10-17 21:29:15.887221
20,"New York, NY",Astrid Solutions,Knowledge of current trends in Big Data frameworks and Data pipeline architecture is preferred. This is an opening to fill a Data Scientist consulting position...,ea39755b93f40ec1,Data Scientist,,,,14 days,2016-10-17 21:29:15.887221
21,"New York, NY",Macy's,"(preferred) in relevant technical field such as Applied Mathematics, Computer Science, Engineering, Physics, or Economics....",40d1d5104c41e124,Data Scientist,,43.2,14182,13 days,2016-10-17 21:29:15.887221
22,"Newark, NJ",Cara Resources,Investigate data visualization and summarization techniques for conveying key findings related to the applied analytics....,ec83cd40d3c897e3,Data Scientist,,42.0,2,11 days,2016-10-17 21:29:15.887221
23,"Palo Alto, CA",Umpqua Bank,You will be eager to think about how machine learning and analytics can help change the ways people manage money and transact commerce....,244312a132b3327e,Pivotus Ventures - Data Scientist - Palo Alto,"$100,000 - $160,000 a year",43.8,88,11 hours,2016-10-17 21:29:15.887221
24,"New York, NY",Tilting Point,"As Data Scientist, you will work to ensure accurate data reporting in a rapidly changing environment. In depth statistical, machine learning, and Bayesian...",0031cd87a7cc62f9,Data Scientist,,,,14 days,2016-10-17 21:29:15.887221
25,"Weston, FL",Teva Pharmaceuticals,"The Data Scientist will have a proven track record of being able to interpret strategic business initiatives and challenges, direct the preparation of large...",ae4fe944746f46db,Data Scientist,,43.2,254,1 hour,2016-10-17 21:29:15.887221
26,"New York, NY",Countr,Data is your mojo...gets a thrill diving deep into data and solving complex data problems on a daily basis....,10c690ad557e6cea,Data Scientist,,,,18 days,2016-10-17 21:29:15.887221
27,"Boston, MA",Analysis Group,"Creating interactive analytics portals and data visualizations (e.g., using R/Shiny, Python/Flask, D3)....",104372296a1d5292,Data Scientist,,53.4,5,4 days,2016-10-17 21:29:15.887221
28,"New York, NY",YouNow,Conduct in-depth research and analyses that translate data into actionable insights. Collaborate with the data science team on new data products and initiatives...,2cedd585ce62c6e4,Data Scientist/Analyst,,,,18 days,2016-10-17 21:29:15.887221
29,"Manhattan, NY",JPMorgan Chase,"Digital Data Scientist. 5+ years of combined industry and/or academic (BS/MS/PhD) experience, with an emphasis on machine learning and data analysis....",7acc50463aab0cd5,Digital Data Scientist,,44.4,10704,3 days,2016-10-17 21:29:15.887221
30,"New York, NY 10010 (Gramercy area)",Aetna,"This position will use predictive and behavioral analytics, and analytically derived insights to develop and test solutions that improve consumer engagement,...",a820a2f943a047f8,Data Scientist,,43.8,1717,12 days,2016-10-17 21:29:15.887221
31,"Redmond, WA 98052",Microsoft,"Experience with information retrieval, data mining, machine learning and natural language understanding,. We're looking for someone who has a strong background...",2b66e92b8e367859,Data Scientist 2,,52.199997,2485,2 days,2016-10-17 21:29:15.887221
32,"McLean, VA","Consulting Services Group, LLC","Data Scientist McLean, Virginia. The candidate will help develop novel analytical approaches for parsing bulk internet data sets, develop data mining algorithms...",f091c6b4baf7a1a5,Data Scientist,,,,7 hours,2016-10-17 21:29:15.887221
33,"Redmond, WA",krg technology inc,Job Description Language Processing: •experience or knowledge of language technology •experience or knowledge of computational linguistics and annotated,51fedbe2ffe07d6a,Jr Data Scientist,,,,3 days,2016-10-17 21:29:15.887221
34,"New York, NY 10016 (Gramercy area)",FactSet,Processing of financial data. With our Machine Learning and Language Technologies(MLT). FactSet is a financial data. Financial information and analytics....,58d126cd5579695b,Machine Learning Engineer Internship,,43.8,42,2 days,2016-10-17 21:29:15.887221
35,"New York, NY",Inficare,"Optimization, Machine learning, Data mining, AI, Simulation, Social network analysis, Churn prediction, Segmentation analysis, Text analysis and Streaming data...",aa69dfb416c21645,Data Scientist,,,,3 days,2016-10-17 21:29:15.887221
36,"New York, NY",OnDeck,Join our team of data scientists as we work to understand small business better than any other lender. Conduct deep dives into the performance of our portfolio...,9504dbe724c0c491,Risk Data Scientist,,52.800003,3,11 days,2016-10-17 21:29:15.887221
37,"Mountain View, CA",ZingBox,Apply machine learning/anomaly detection techniques to detect IoT devices anomaly behaviors and security threats....,edd91a36ee8926eb,Data scientist,,,,7 hours,2016-10-17 21:29:15.887221
38,"San Francisco, CA",Hoodline,Develop machine learning and data mining algorithms to extract meaningful information from thousand to millions articles....,dd86068e34d0f55a,Machine Learning Data Scientist,,,,5 days,2016-10-17 21:29:15.887221
39,"New York, NY",Schrodinger,"Familiarity with deep learning, neural networks, random forest, support vector machines, and other machine learning techniques....",d5cbd1a80c153dfb,Machine Learning Engineer,,,,1 day,2016-10-17 21:29:15.887221
40,"Brooklyn, NY",NATIONAL GRID CO USA (NE POWER),"Understanding of Data Mining and Machine Learning Techniques. Employ sophisticated analytics programs, machine learning, and statistical methods to prepare data...",e2d654133269eb31,Data Scientist,,,,11 days,2016-10-17 21:29:15.887221
41,"Charlottesville, VA 22909 (North East area)",S&P GLOBAL MARKET INTELLIGENCE,"Experience with data mining, machine learning, natural language processing, and data visualization. As a Data Scientist, you will be responsible for the...",dc6403594898f43a,DATA SCIENTIST,,43.2,20,3 days,2016-10-17 21:29:15.887221
42,"Redmond, WA",Cognizant,If you require accessibility assistance applying for open positions in the US please send an email with your request to CareersNorthAmerica@cognizant.com....,937826dda415d0d4,Data Scientist,,51.0,4720,3 days,2016-10-17 21:29:15.887221
43,"Santa Clara, CA",Roche,In this entry level role you will learn the theory and operation of the new Genia Single Molecule Sequencing platform and help take the machine from an advanced...,3b879e6af66e9d23,"Data Scientist I, Sequencing",,52.199997,336,7 days,2016-10-17 21:29:15.887221
44,"Charlotte, NC",IT America,"As a data scientist in our new analytics team, you will be responsible to work on digital sales prediction models with a focus on machine learning and...",5a83ea92d0a00d8e,Data Scientist,,,,11 hours,2016-10-17 21:29:15.887221
45,"Palo Alto, CA",HP Inc,"The Customer and Marketing Analytics group in HP Inc’s Global Marketing organization has been charted to provide deep insights, predictions and optimization...",7a6e392e7105d9d7,Data Scientist,,,,14 hours,2016-10-17 21:29:15.887221
46,"New York, NY 10011 (Chelsea area)",Google,Experience with data analytics and/or data visualization techniques and software. Experience interpreting technical data and creating reports with data....,123a06bb156c1ef6,"Machine Learning Deployment Engineer, Professional Services,...",,52.800003,1219,17 days,2016-10-17 21:29:15.887221
47,"Annapolis Junction, MD",Booz Allen Hamilton,"Develop machine learning, data mining, and statistical and graph-based algorithms designed to analyze massive data sets and partner with Cloud technologists to...",ba4b73e8d55aa554,Data Scientist,,44.4,946,23 minutes,2016-10-17 21:29:15.887221
48,"Baltimore, MD",Softrams LLC,"Knowledge of healthcare claims data. 4+ years of professional experience with programming and software development, including Python, R, or another language...",60dfe14c1c9970fc,Data Scientist,,,,3 days,2016-10-17 21:29:15.887221
49,"Newark, NJ",Horizon Blue Cross Blue Shield of New Jersey,"The Data Scientist is a subject matter expert and individual contributor that will create, decipher, and utilize sophisticated statistical/econometric data...",98edf34c1bbc1d7b,Data Scientist,,51.0,298,17 days,2016-10-17 21:29:15.887221
50,"Menlo Park, CA",Facebook,"Scientists should be proficient in R. Responsibilities Scientists will be expected to design and implement novel experiments or quasi-experiments, and develop...",58ccb9c5ee7bd1da,"Data Scientist, Core Data Science",,51.0,114,8 days,2016-10-17 21:29:15.887221
51,"Santa Clara, CA 95054",LumenData,"Classifying streaming machine data to enable powerful predictions on machine energy consumption, efficiencies, and fault tolerances....",87e4c665f3ea3a61,Data Scientist,,51.0,2,17 hours,2016-10-17 21:29:15.887221
52,"Short Hills, NJ 07078",Dun & Bradstreet,If you are interested in applying for employment with Dun & Bradstreet and need special assistance or an accommodation to use our website or to apply for a...,f55ff122a5f16469,"Statistician, Advanced Analytics",,43.8,148,7 days,2016-10-17 21:29:15.887221
53,"Schaumburg, IL",Zurich North America,"Data Scientist, you will:. Experience in applying data transformation. Matching), text mining, and data reduction....",803bc11db25af670,Jr. Data Scientist,,43.2,311,11 days,2016-10-17 21:29:15.887221
54,"Plymouth Meeting, PA",QuintilesIMS,"Apply machine learning, data mining technologies in developing innovative solutions in pharmaceutical industry....",6d914185bb0803d7,Data Scientist,,44.4,439,2 days,2016-10-17 21:29:15.887221
55,"Chicago, IL",Brad's Deals,Brad’s Deals is looking for an experienced data scientist to join our team. Develop recommender systems based on behavioral data....,4345e7fc5772b24a,Data Scientist,,,,1 day,2016-10-17 21:29:15.887221
56,"Basking Ridge, NJ","Smartlink, LLC","Data extraction/transformation/loading, text mining, statistical analysis experience is required. Visualize the analytical results using data visualization...",06c04af265d7da17,Data Scientist,,,,4 days,2016-10-17 21:29:15.887221
57,"Frisco, TX",MoneyGram,Applies advanced knowledge to utilize or produce analytical material for discussions with cross-functional teams to understand business objectives and influence...,23a5db879d0999ee,Data Scientist,,43.2,130,10 days,2016-10-17 21:29:15.887221
58,"San Diego, CA",HP Inc,"Excellent analytical thinking, analysis, and problem solving skills Ability to communicate abstract ideas clearly and independently manage complex project...",6de001f3d3b878cf,Data Scientist - Big Data Analytics Development,,,,14 hours,2016-10-17 21:29:15.887221
59,"New York, NY 10011 (Chelsea area)",Spotify,You will work in collaboration with other mathematicians and scientists in Research and with data engineers and design technologists across Analytics to imagine...,db099e1752ee46dd,Research Lead / Data Scientist,,54.6,12,19 days,2016-10-17 21:29:15.887221
60,"Mountain View, CA 94039",Intuit,"Deep mastery of machine learning - Candidate must have a deep mastery of a wide range of ML techniques, tools, and methodologies with a demonstrated capability...",e0522e65ebac1469,Data Scientist,,52.199997,467,3 days,2016-10-17 21:29:15.887221
61,"Memphis, TN",Sedgwick Claims Management Services,"Collaborates with data management team to develop, refine, and scale data management and analytics procedures, systems, workflows, best practices, and other...",9bd9b0ee42c75607,Data Scientist,,40.8,468,7 days,2016-10-17 21:29:15.887221
62,"San Francisco, CA 94114 (Castro-Upper Market area)",Apple,"We are looking for scientists who are passionate about creating data driven systems and have experience in statistical programming, machine learning, and use of...",b1c75056addc71fd,"Software Engineer, Data Scientist",,52.800003,2573,5 days,2016-10-17 21:29:15.887221
63,"San Jose, CA",PayPal,"Data Science & Analytics. Responsible for overcoming the challenges presented by big data, evolving fraud techniques, and new payment technologies by leveraging...",05383d03c5575dab,Data Scientist 2,,44.4,422,3 days,2016-10-17 21:29:15.887221
64,"Boston, MA 02111 (Central area)",Autodesk,"You have a Bachelor's degree focused on operations research, applied statistics, data mining, machine learning, physics or a related quantitative discipline....",522547d5f3872824,Data Scientist (Boston),,52.199997,147,4 days,2016-10-17 21:29:15.887221
65,"New York, NY 10013 (Tribeca area)",Rent the Runway,Apply expertise in quantitative analysis and data mining to see beyond the numbers and extract actionable insights on how our customers use our service and...,1769c71322d8898f,Data Analyst / Data Scientist,,42.6,28,17 days,2016-10-17 21:29:15.887221
66,"San Francisco, CA",Zynga,"Probability, statistics, data mining, predictive modeling, experimental design, computational analytics, econometric modeling....",41c2b86261039a04,"Data Scientist, Central Product Management",,44.4,36,4 days,2016-10-17 21:29:15.887221
67,"Solana Beach, CA",Amazon Corporate LLC,Do you want to join an innovative team of scientists who use machine learning and statistical techniques to keep Amazon the safest and most trusted place to...,205e554c1913e597,Applied Machine Learning Scientist,,43.2,9618,7 days,2016-10-17 21:29:15.887221
68,"Waukesha, WI 53188",GE Healthcare,"Experience with data extraction, data cleansing, data manipulation, ETL tools, and big data technologies, data dictionaries, and data management processes....",e0e251b42cca35dd,Global Service Data & Analytics – Data Scientist,,51.0,690,12 hours,2016-10-17 21:29:15.887221
69,"Providence, RI",Brown University,"Tableau), and the Linux operating system.Ability to manage multiple projects with competing priorities and deadlines.An eagerness to take ownership of...",cc5bb8a17803f945,Data Scientist,,54.0,71,4 days,2016-10-17 21:29:15.887221
70,"New York, NY",Dataminr,"Solid background in data mining, data visualization, statistical analysis, computational NLP or machine learning with at least 5 years experience....",eb832581181ee415,Data Scientist,,,,24 days,2016-10-17 21:29:15.887221
71,"Redmond, WA",Brillio,"Understands Machine learning algorithms, Natural language processing and preferably worked on Azure ML, HDIsight. Python or R or SAS....",aabb86c000318064,Data Scientist,,40.8,16,1 day,2016-10-17 21:29:15.887221
72,"New York, NY 10154 (Midtown area)",KPMG,"Machine learning, data visualization, statistical modeling, data mining, or information retrieval. KPMG is currently seeking a Data Scientist to join our...",ad6cac7cd99c095b,Data Scientist,,51.0,1768,3 days,2016-10-17 21:29:15.887221
73,"Alexandria, VA 22303",TransVoyant,Understanding of Hadoop stack and data analytics tools to exploit massive sets of TransVoyant data (e.g. The ideal candidate will structure data and create the...,dbc367d190e27b00,Data Scientist,,,,8 days,2016-10-17 21:29:15.887221
74,"San Diego, CA",EXPERIAN,Job Description - Data Scientist (162066) Experian is an Equal Opportunity Employer Data Scientist - Job Number:....,99ae3bd00652379f,Data Scientist,,42.6,262,6 days,2016-10-17 21:29:15.887221
75,"Cincinnati, OH 45249",Vantiv,"We're looking for exceptional data scientists to play a pivotal role in the research and development of data products, drive better and faster decision making...",aed81bd0c51ab1b9,Data Scientist,,42.0,102,5 days,2016-10-17 21:29:15.887221
76,"New York, NY 10112 (Midtown area)",Comcast,Are you ready to go beyond classic predictive analytics and machine learning to newer areas like deep learning and micro-contextual analytics to obtain...,bf398f7e222d401a,Data Scientist II,,43.8,6371,19 days,2016-10-17 21:29:15.887221
77,"New York, NY",VaynerMedia LLC,Potential Applications of Data Science at VaynerMedia:. Prototype new data driven features for our reporting platform....,b6230f79459b0940,Data Scientist - AdTech,,,,14 days,2016-10-17 21:29:15.887221
78,"Mountain View, CA 94043",Retail Solutions,"Familiar with R programming, can use R to create analysis programs using linear regression, pattern recognition, machine learning methods....",3f655fdd7ded88e1,Data Scientist,,,,6 days,2016-10-17 21:29:15.887221
79,"Cleveland, OH",Nityo Infotech Services Pvt. Ltd.,"Knowledge of classification systems and clinical vocabularies and nomenclature, such as International Classification Of Diseases (ICD)-9, Current Procedural...",d0b1d924fa3a9be7,Data Scientist,,,,6 days,2016-10-17 21:29:15.887221
80,"Seattle, WA",Pacific Northwest National Laboratory,Data Science & Analytics. Data science at Pacific Northwest National Laboratory performs data\-driven research and discovery facilitated by the tools and...,7b7251537d5b1096,Data Scientist - Applied Machine Learning,,44.4,39,7 days,2016-10-17 21:29:15.887221
81,"Longmont, CO",Seagate,"Requires academic coursework or industry experience in applied math, advanced statistics, big data, data mining, and machine learning....",996c82ad15ac5368,Data Scientist II,,51.0,236,4 days,2016-10-17 21:29:15.887221
82,"Seattle, WA",Remitly,"As a data scientist, you will provide expertise on statistical and machine learning concepts for the broader group of analysts throughout the company and push...",c7d4f15e0329d205,Data Scientist,,,,2 days,2016-10-17 21:29:15.887221
83,"Mountain View, CA",Siemens,"Proven success as data scientist/architect working with large data sets, preferably health data, and using analytics to drive growth of a service/product....",d3903aae9833d955,Data Scientist,,51.6,4063,15 days,2016-10-17 21:29:15.887221
84,"San Bruno, CA 94066",Walmart eCommerce,"Data Scientists are responsible for researching new trends in the industry and utilizing up-to-date technology (for example, HBase, MapReduce, LAPack, Gurobi)...",2fcdda0daec2e002,Data Scientist,,42.0,17,4 hours,2016-10-17 21:29:15.887221
85,"Bentonville, AR 72712",Walmart,"Bachelors degree in Statistics, Economics, Analytics, Mathematics, Computer Science, Information Technology or related field and 7 years experience in an...",b969d893af102c80,Associate Data Scientist-ISD,,42.6,73259,4 hours,2016-10-17 21:29:15.887221
86,"Santa Barbara, CA 93103",HG Data,"We are looking for a data scientist with software development background. HG DATA CULTURE:. An interest in Machine Learning and Natural Language Processing, as...",e23db0778853ece8,Data Scientist,,,,10 days,2016-10-17 21:29:15.887221
87,"Cary, NC",MetLife GTO,"Participates as team member on research, data mining, predictive modeling, and/or business analytics projects....",31e4947819d45766,Data Scientist II,,,,4 days,2016-10-17 21:29:15.887221
88,"Fort Worth, TX 76177",DynCorp International LLC.,"Two (2) or more years’ experience in data mining, statistics / mathematics modeling, machine learning, text mining, and stream analytics....",3f6c26ead281efde,Data Scientist,,44.4,24,6 days,2016-10-17 21:29:15.887221
89,"Charlotte, NC",Bank of America,"The data scientist will:. This role requires a mixture of data analysis, technical project management, enterprise data management and IT database technician....",3f3d1107203bcee8,"Data Scientist (Charlotte, NYC, Jacksonville, Plano)",,44.4,14240,3 days,2016-10-17 21:29:15.887221
90,"Boston, MA 02111 (Central area)",Plymouth Rock Assurance Corporation,"An advanced degree in mathematics, machine learning, economics, statistics or a related field (background in Bayesian statistics preferred)....",7d23fb51a6d2b792,Data Scientist,,,,5 days,2016-10-17 21:29:15.887221
91,"Chicago, IL","Vizient, Inc.","Serves as the resident data expert and share best practices/approaches for statistics, machine learning techniques, data modeling, simulation and advanced...",9a441b69e587736a,Data Scientist,,,,4 days,2016-10-17 21:29:15.887221
92,"Houston, TX",Exxon Mobil,"Experience in relevant areas of scientific expertise (e.g., machine learning, numerical methods, signal processing, statistics, mathematics, and optimization)....",857a318d918bc7ce,Data Scientist,,51.0,1005,12 days,2016-10-17 21:29:15.887221
93,"Alpharetta, GA 30005",Equifax,"At least 5-10 years of working experience in analytics, data mining, data visualization, and/or predictive modeling....",51ed96d2736b48c2,"Data Scientist, Identity & Linking",,43.2,220,8 hours,2016-10-17 21:29:15.887221
94,"Mountain View, CA 94043",Edison Pharmaceuticals,Edison is seeking a Data Scientist to analyze raw instrument data and predict/control biology from large data sets....,80bdeb4dbb6c87cf,Data Scientist,,,,4 days,2016-10-17 21:29:15.887221
