,location,company,summary,jkid,title,salary,stars,reviews,post_date,pull_date
462,"Ralston, NE",Oriental Trading,Oversees and supervises the responsibilities of the Data Scientists and Data Science Analysts. Experience with machine learning techniques and advanced...,e7df7a1240231a78,Marketing Data Science Leader,,41.4,25,6 days,2016-10-17 21:29:15.887221
463,"New York, NY 10038 (Financial District area)",automotiveMastermind Inc.,"An MS/PhD program in Statistics, Mathematics, Physics, Computer Science/Machine Learning, Bioinformatics, Neuroscience and other technical discipline, or else...",2d12ad4b56eb3cb8,Data Scientist,,,,30+ days,2016-10-17 21:29:15.887221
464,"Boston, MA",Broad Institute,"Experience with a scientific programming environment, such as R or Matlab, is preferred. By applying your computational and modeling skills to multimodal cancer...",0359bab3f764f451,"Data Scientist, Machine Learning",,51.6,17,24 days,2016-10-17 21:29:15.887221
465,"Kansas City, MO 64106 (Downtown area)",The Nerdery,"Experience with Machine Learning algorithms, Data Mining techniques, Data Munging. Find meaningful patterns in data utilizing Python, R, or SAS....",bd051ff96521f084,Data Scientist: Kansas City,,40.2,5,30+ days,2016-10-17 21:29:15.887221
466,"Springfield, MO 65802",Leidos,The Data Scientist Journeyman will analyze actual and predictable interacting operational activities of given target sets and client requests to obtain an...,f62627498c4f261e,Data Scientist Journeyman,,43.8,187,27 days,2016-10-17 21:29:15.887221
467,"New York, NY",Rocket Fuel Inc.,Rocket Fuel’s technology platform supports a real-time bidding system that handles over 100 billion events every day (vs ~ 3 billion daily Google search queries...,b59eaac4ff5ac563,Software Engineer - Machine Learning & Artificial Intelligen...,,,,24 days,2016-10-17 21:29:15.887221
468,"Research Triangle Park, NC 27709",SciMetrika,ScitoVation scientist have earned a reputation for developing and applying state-of-the-art modeling techniques that lead to more accurate and biologically...,5a6bca92e8012c2a,Statistical Modeler,,52.800003,3,2 days,2016-10-17 21:29:15.887221
469,"New York, NY",Spencer Ogden,"Seeking Data Scientist (5 years) with experience working on data service products / algorithms. Data modelling, datasets, regression, statistics....",4f0f82e5d00c2f8c,Data Scientist / Quant Developer,,41.4,7,4 days,2016-10-17 21:29:15.887221
470,"Draper, UT",Crest Financial,"Provide analytics expertise, direction and guidance to data scientists, technical architects and business users to enable efficient and robust analytics...",a35a417e7ecb1dea,Data Scientist / Statistician,,42.0,11,12 days,2016-10-17 21:29:15.887221
471,"Framingham, MA",Applause,"Data Engineer, Framingham, MA (Greater Boston Area). Whether working with PostgreSQL, MySQL, MongoDB, Redis, DynamoDB, or Google BigQuery, we need your passion...",c23cfe29773b7c88,Data Scientist,,54.0,6,29 days,2016-10-17 21:29:15.887221
472,"Eagan, MN",Ecolab,Ecolab is looking for a talented data scientist to work in a start-up like in-house innovation hub chartered with creating big data analytics and data science...,82cbeb4e41de26f4,Data Scientist,,42.6,574,30+ days,2016-10-17 21:29:15.887221
473,"Denver, CO 80202 (Lodo area)",Ray Allen,"The candidate will be supporting our Data Engineering team in developing and updating BI Dashboards using Qlik Sense, establishing ETL processes, creating...",f18fefb3ce91da7d,Associate Data Scientist,,,,30+ days,2016-10-17 21:29:15.887221
474,"Chicago, IL",Ipsos North America,"DAAS is a team of statisticians, social scientists, and data specialists based in our Washington DC and Chicago IL offices who develop customized, high quality...",a43b889603b867af,USPA - Statistical Programmer,,42.6,185,2 days,2016-10-17 21:29:15.887221
475,"Honolulu, HI",American Savings Bank - Hawaii,Provides data analytics in support of the company’s enterprise risk management program. O Minimum ten (10) years of relevant risk or finance experience with...,e500b0af8b271c72,DATA SCIENTIST,,,,27 days,2016-10-17 21:29:15.887221
476,"Mountain View, CA",Astreya,"Data Scientist for Hardware Product Analytics team for a well known company headquartered in Mountain View, California....",a901dbe95c2862c5,Data Scientist - Hardware Product Analytics,,,,10 days,2016-10-17 21:29:15.887221
477,"San Francisco, CA",BOLD,Develop novel and scalable data systems in cooperation with our architects that leverage Big Data sets and machine learning techniques to enhance the user...,70b5977bdf506f99,Data Scientist,,41.4,8,21 days,2016-10-17 21:29:15.887221
478,"Hunt Valley, MD",Sinclair Broadcast Group,Identify and prioritize enterprise data analytics opportunities. Experience with Hadoop or other Map-Reduce data analytics processes....,0e51ba1b112e5771,Data Scientist,,39.0,44,29 days,2016-10-17 21:29:15.887221
479,"Sunnyvale, CA 94089",Baidu USA,Big Data Lab in Silicon Valley has an agile team of scientists and experienced machine learning practitioners....,8c8094a411083687,Research Scientist – Big Data Lab,,,,27 days,2016-10-17 21:29:15.887221
480,"Sunnyvale, CA 94089",Baidu USA,Big Data Lab in Silicon Valley has an agile team of scientists and experienced machine learning practitioners....,8c8094a411083687,Research Scientist – Big Data Lab,,,,27 days,2016-10-17 21:29:15.887221
481,"St. Louis, MO",Express Scripts,Lead the analyses of various structured or unstructured data sources for identifying actionable insights to enhance service delivery and improve Rx volume using...,46c883b94be923fa,Sr Data Scientist - Text Mining,,41.4,1781,16 days,2016-10-17 21:29:15.887221
482,"San Francisco, CA 94107 (South Of Market area)",Scribd,"2-5+ years of professional experience in data analytics across multiple disciplines (BI, product, marketing, data science, etc)....",0b09d641bbfa9bea,Data Scientist,,,,17 days,2016-10-17 21:29:15.887221
483,"Portage, MI",Stryker,"Minimum 5-7 years of applied technical experience in analytics, visualization, big data (Hadoop), search and various data integration tools....",f61c54914bc810dd,"IS Data Scientist, BI Analytics",,51.0,418,30+ days,2016-10-17 21:29:15.887221
484,"San Diego, CA","Mitchell International, Inc.","As a Machine Learning Data Scientist Intern, you will have the opportunity to solve challenging problems or build predictive models across a broad range of...",86f774a1cfe6e5e1,Machine Learning Internship,,39.0,3,17 days,2016-10-17 21:29:15.887221
485,"Miami, FL 33132 (Downtown area)",Royal Caribbean Cruises Ltd.,"In-depth experience in data mining, business intelligence, data analytics, and project management required....",0595d86f74b60cae,Data Scientist,,52.199997,788,17 days,2016-10-17 21:29:15.887221
486,"New York, NY",SparkBeyond,"We’ve built an AI-powered research engine that empowers Data Scientists, Researchers and Business Analysts to accelerate finding insights....",4dbc120b5a547c15,Data Scientist,,,,30+ days,2016-10-17 21:29:15.887221
487,"Boston, MA",eviCore healthcare,"Design, develop, and prototype machine learning and statistical analysis techniques to automate clinical decision making, including deep learning, collaborative...",d3e7ee950f19bc93,Machine Learning Data Scientist,,,,17 days,2016-10-17 21:29:15.887221
488,"Maplewood, MN",3M,"Familiarity with knowledge analytics and data mining. Ability to interact with scientists and managers, understand their technical or business needs....",ec35bcb654ae5362,"Advanced Technical Information Analyst* (Maplewood, MN) Job",,51.6,1414,30 days,2016-10-17 21:29:15.887221
489,"Stanford, CA 94305",Stanford University,"We are hiring two Data Scientists. Population analytics, machine learning, statistical methods, distributed computing, algorithm development, variant annotation...",a20451558c79c6ff,Data Scientist-2 Positions,,52.800003,244,30+ days,2016-10-17 21:29:15.887221
490,"New York, NY 10005 (Financial District area)",WeWork,"Deep knowledge of machine learning and data mining. In quantitative relevant subject (such as science, computer science, statistics, or machine learning) is...",694b5907f188c348,Data Scientist,,41.4,12,30+ days,2016-10-17 21:29:15.887221
491,"Murray, UT 84107",Finicity,"As a Data Scientist, you will take lead on exploring and creating business value from data science operations in new business data domains, working with other...",16b8c0ab45e6897a,Data Scientist,,43.2,7,6 days,2016-10-17 21:29:15.887221
492,"New York, NY",NGDATA Inc,"Involved very closely with various analytical groups to provide consultation on high-level concepts and prototype coding, including Data Scientists, Risk...",dba73223f0eb8431,Big Data Software Consultant,,,,7 days,2016-10-17 21:29:15.887221
493,"Seattle, WA 98103 (Green Lake - Wallingford area)",Allen Institute,They will work under the guidance of a software engineer and scientists working with the microscopes. Post-processed data management....,2217577a3ff2408f,Python Developer (Microscopy Tools),,,,12 days,2016-10-17 21:29:15.887221
494,"Arlington, VA",Aptima,"In Mathematics, Computer Science, or related technical field Minimum of two years of experience performing data analysis on large data sets in a team...",8307b10ed9897c37,Data Scientist (Junior) (VA),,,,21 days,2016-10-17 21:29:15.887221
495,"Seattle, WA",Amazon Corporate LLC,"Work closely with service engineers, product managers, other applied scientists, and customers. Applied Scientist, Information Retrieval - Amazon CloudWatch....",759bada53a89a9f5,"Applied Scientist, Information Retrieval - AWS",,43.2,9618,18 hours,2016-10-17 21:29:15.887221
496,"Boulder, CO",CaliberMind,Preferred - PhD in Computer Science including machine learning and data mining. Recruitment and mentoring of a team of data scientists evolving distinctive...,63265dc03e382020,Senior Data Scientist,"$120,000 a year",,,24 days,2016-10-17 21:29:15.887221
497,"New York, NY",OnDeck,"Using industry technologies, tools and data mining frameworks for data analytics including data visualization for analyzing and drawing conclusions,....",3b8698940dfae0c3,Data Analyst,,52.800003,3,13 days,2016-10-17 21:29:15.887221
498,"San Mateo, CA",Fanatics Inc.,"MTS 2, Data Scientist. Leverage these foundational Data Infrastructure to integrate machine learning & statistical models into real time services and power the...",3e5929fd56783275,"MTS 2, Data Scientist",,,,30+ days,2016-10-17 21:29:15.887221
499,"Boston, MA 02110 (Central area)",Verizon,"Or Master’s Degree in operations research, applied statistics, data mining, machine learning, physics, related quantitative discipline or work experience....",14a1d8e769d07bef,Senior Data Scientist,,44.4,11117,11 days,2016-10-17 21:29:15.887221
500,"Redwood City, CA 94065",Electronic Arts,"A successful candidate will use his or her expertise in software development and data mining to build data products that power EA games and services, and...",001ded80b34ceaa5,"Software Engineer, Data Science",,44.4,253,2 days,2016-10-17 21:29:15.887221
501,"Cleveland, OH",Medical Mutual of Ohio,"Knowledge of health plan operations, data sources, and data structures, including trends and drivers of quality, utilization and costs....",550c7a7a678ea986,Data Scientist I- Career Development Program,,51.0,56,20 days,2016-10-17 21:29:15.887221
502,"New York, NY",AIG,"The role will require a considerable amount of collaboration and communication with many different parts of AIG, from senior business stakeholders to IT...",c07521135ace46b7,Data Analyst-Underwriting Analytics,,43.8,893,12 days,2016-10-17 21:29:15.887221
503,"Westminster, CO",Oracle,"Data Scientists galore. Competency with big-data tools—such as SQL, Python, R, SAS. As a Senior Data Scientist on the Retail Analytics team, you would combine...",5dd2220530ef426d,Senior Data Scientist - Retail Analytics,,44.4,1013,4 days,2016-10-17 21:29:15.887221
504,"McLean, VA",Byte Systems,"Demonstrated experience of appropriate analytic methods and methodological tools in the following areas Applied mathematics (e.g., probability and statistics,...",28c45fb4751c28f9,Data Scientist,,,,19 days,2016-10-17 21:29:15.887221
505,"Berkeley, CA","Wise.io, Inc.","We are seeking data scientists who:. Each new project will require you to identify business problems, massage dirty and unstructured datasets, build out an...",743867c5fae7ba2a,Data Scientist,,,,23 days,2016-10-17 21:29:15.887221
506,"Dearborn, MI",Miracle Software Solutions,"Data Scientists Analysts (7500). The Data Operations team is a key department within Ford's growing Global Data, Insights and Analytics division....",5415748623ffd17f,Data Scientists Analysts,,,,12 days,2016-10-17 21:29:15.887221
507,"New York, NY",Wade & Wendy,"Software Engineering, Python, Data Visualization, Machine Learning, MySQL, Statistics, Optimization, Mathematics, MongoDB, Search, Databases, RESTful Services,...",26351741201154c5,Wade & Wendy_Data Scientist/Engineer,"$80,000 - $120,000 a year",,,30+ days,2016-10-17 21:29:15.887221
508,"New Haven, CT 06511 (Newhallville area)",Yale New Haven Health Services,"The Data Scientist will have a proven track record of being able to interpret strategic business initiatives and challenges, direct the preparation of large...",1b24e9c85eda7c36,DATA SCIENTIST,,52.800003,4,30+ days,2016-10-17 21:29:15.887221
509,"Bellevue, WA",T-Mobile,"Own & Manage big data and analytics platform for team (IT teams will build them). As a Senior Big Data Scientist, you will have opportunity to work with one of...",5a5a811336bbec2a,Big Data Scientist,,51.0,4561,30+ days,2016-10-17 21:29:15.887221
510,"Raleigh, NC","Resolvit, LLC","Technical knowledge regarding data models, database design development, data mining, and segmentation techniques....",878679eb0829e3f2,Data Scientist,,39.0,10,27 days,2016-10-17 21:29:15.887221
511,"Austin, TX",AMD,"Data Scientist, Product Data Analytics – Austin, TX. Undergraduate Computer Science or Statistics degree and 10+ years analytics experience or Graduate degree...",f55f34b5a7bfcc7f,"Data Scientist, Product Data Analytics",,43.2,243,26 days,2016-10-17 21:29:15.887221
512,"Phoenix, AZ 85002 (Central City area)",Intel,"Exploratory data analysis, data mining, Machine learning algorithms. 3 months of experience with Data mining and Big Data....",e7796037f7e12004,Data Analysis & Statistical Methods Intern 2017,,52.199997,1960,6 days,2016-10-17 21:29:15.887221
513,"New York, NY 10019 (Midtown area)",BET Networks,"Keep on top of Industry trends and key consumer insights. Knowledge of syndicated data systems (MRI, JD Power, Forrester)....",559b90d3118fded1,"Research Analyst, Ad Sales",,44.4,55,3 days,2016-10-17 21:29:15.887221
514,"Washington, DC",Selby Jennings,Associate Data Scientist. Work with experienced data scientists and learn an industry that is always growing in a laid back environment....,be8c72873ae03efa,Associate Data Science,"$125,000 - $150,000 a year",,,12 days,2016-10-17 21:29:15.887221
515,United States,Verisk Analytics,"Building and applying machine learning/predictive modelling in real-world use cases. As a Verisk data scientist, you’ll receive hands-on analytics experience...",59528eac8931f0f4,Data Scientist I,,42.6,24,26 days,2016-10-17 21:29:15.887221
516,"Tampa, FL 33634",WellCare,Health Services - Quality & Analytics. 3 years of experience in relevant programming to include SAS or SQL....,c2e20613aded223c,Statistician - Healthcare Quality Analytics,,42.6,565,13 days,2016-10-17 21:29:15.887221
517,"Atlanta, GA",Centers for Disease Control and Prevention,"Whether we are protecting the American people from public health threats, researching emerging diseases, or mobilizing public health programs with our domestic...",40d8215afa28f4bb,HEALTH SCIENTIST,"$88,305 - $114,802 a year",54.0,64,2 days,2016-10-17 21:29:15.887221
518,"Santa Clara, CA",NVIDIA,"Delivering deep learning projects, from project scoping, developing statements of work, data ingest, data management, deep learning training, and final...",a4afb5e79432253b,Professional Services Data Scientist Consultant,,51.6,88,30+ days,2016-10-17 21:29:15.887221
519,"Dallas, TX",Markit Financial Info Service," Preferable IT skills (Python, SQL).  Very good and relevant operational experience. The successful candidate will be working as part of the global Index...",e23204a1bc96498b,"Associate, Entry Level Quantitative Analyst",,,,7 days,2016-10-17 21:29:15.887221
520,"Orlando, FL",USM,"Uses descriptive and inferential statistics, data mining, predictive modeling and machine learning techniques to develop insights that will optimize cost and...",b744869013f4124b,Data Scientist--------Need GC and USC,,,,30+ days,2016-10-17 21:29:15.887221
521,"Green, OH",StarHub,"As Data Science Engineer at SmartHub, you will work in an agile team of data scientists, engineers and visualizers....",c887f4de203e7c08,Data Science Engineer,,,,30+ days,2016-10-17 21:29:15.887221
522,"Dallas, TX",Atos IT Services and Solutions Inc,"5 years + hands-on experience in one or more Statistical Methods, such as machine learning, information retrieval, data mining, Text Mining, Natural Language...",6227d09b9289fd97,Data Scientist,,,,14 days,2016-10-17 21:29:15.887221
523,"San Diego, CA","TouchCommerce, Inc.","TouchCommerce is seeking a Data Scientist. MS or PhD in Statistics, Applied Math, Computer Science or Machine Learning....",513c06dddb97d102,Data Scientist - San Diego,,,,24 days,2016-10-17 21:29:15.887221
524,"Dearborn, MI 48124",ASG Renaissance,"The Analytics Research and Development team within the company's Global Data, Insight and Analytics (GDIA) organization is looking for a highly skilled...",41c5207d646d5022,Quality Data Analyst,,,,4 hours,2016-10-17 21:29:15.887221
525,"St. Louis, MO",OGSystems,Provide statistical and mathematical support to the Business Analytics (BA) Common Operating Environment (COE) with metric analysis of internal and external...,974a0c5c10685551,Statistician/Data Analyst II,,,,5 days,2016-10-17 21:29:15.887221
526,"Sunnyvale, CA",Walmart eCommerce,"Data Scientists are responsible for researching new trends in the industry and utilizing up-to-date technology (for example, HBase, MapReduce, LAPack, Gurobi)...",adb042b4fee9d4db,Senior Data Scientist,,,,5 hours,2016-10-17 21:29:15.887221
527,"New York, NY 10017 (Midtown area)",Aetna,Other programming languages is a plus.· Demonstrated ability to effectively communicate and negotiate across the business and in the external health care...,e9b19f78ccb9d90f,"Sr. Manager, Data Scientist",,,,25 days,2016-10-17 21:29:15.887221
528,"New York, NY 10001 (Chelsea area)",Uber,"Our mission is to bring increasing numbers of riders and drivers to Uber, and strengthen Uber’s position as the preferred ride-sharing platform in cities around...",a12fe950fa9ca315,Data Scientist - Global Growth,,,,30+ days,2016-10-17 21:29:15.887221
529,Remote,Precision For Medicine,"Furthermore, you will support the advancement and implementation of machine learning, artificial intelligence and systems biology approaches for use on...",0520cd37738f3a2c,Data Scientist,,,,7 days,2016-10-17 21:29:15.887221
530,"Westminster, CO",Oracle,Data scientists and desire to act as a mentor to up and coming data scientists. Other team members and data scientists to brainstorm solutions....,ef3f6cec80e8fdd2,Sr. Data Scientist-Identity Data Science,,44.4,1013,10 days,2016-10-17 21:29:15.887221
531,"San Bruno, CA",Google,"The Business Strategy & Operations organization YouTube strategy provides business critical insights using analytics, ensures cross functional alignment of...",4250350251a3b07b,"Quantitative Business Analyst, YouTube",,52.800003,1219,13 days,2016-10-17 21:29:15.887221
532,"Fremont, CA",Planet Pharma,"The candidate will work within a highly motivated team to deliver high quality results within a fast-turnaround, as part of process analytics....",5e1c8f1603d416ea,Process Scientist I,,,,3 days,2016-10-17 21:29:15.887221
533,"New York, NY",Pozent Corporation,"Strong computer skills (Office, VBA, Bloomberg, SQL, Python). Required Job Skills:....",cfeb76472be0c8ab,Quantitative Finance Analyst,,,,5 days,2016-10-17 21:29:15.887221
534,"Newton, MA","Thermalin Diabetes, LLC",Knack for communicating stories through data visualizations. Format and analyze data to extract key performance parameters....,6a7c9e08a21183c5,"Data Scientist - Newton, MA (will work in Boston, MA area)",,,,21 days,2016-10-17 21:29:15.887221
535,"San Francisco, CA",Twilio,"In doing so you’ll help to realize our team’s mission of providing deep insight, actionable intelligence and machine learning systems in a company experiencing...",78540a2dc40e5ca4,Data Scientist,,60.0,3,20 days,2016-10-17 21:29:15.887221
536,"Rochester, NY",IBM,"The Finance Data Analytics Consultant’s objective is to help deliver innovative analytics solutions based on deep Business Intelligence, Big Data and insight...",d406c30e53759944,Finance Data Analytics Consultant,,51.0,12128,12 days,2016-10-17 21:29:15.887221
537,"Redwood City, CA",IMVU,"1+ years’ experience in a data science/analytics role (aka analytics, data insights, database marketing, CRM business data analysis, data mining, and business...",5f81197122b5e949,Data Scientist,,53.4,10,14 days,2016-10-17 21:29:15.887221
538,"Loveland, CO",KeyPoint Government Solutions,"Data Scientist will work with the data science team to build, maintain, and summarize predictive models of business processes in R and Python....",bd7cb4b50585953a,Sr. Data Scientist,,,,10 days,2016-10-17 21:29:15.887221
539,"Basking Ridge, NJ",Bartech Group,Wireless Data Scientist. Available benefits for the Wireless Data Scientist position include (but are not limited to:....,9b53ecba3e33ee36,Wireless Data Scientist,$62 an hour,43.8,43,4 days,2016-10-17 21:29:15.887221
540,"San Francisco, CA 94107 (South Of Market area)",Eventbrite,"We sit in a strategic role working to make sense of our structured and unstructured customer data with sophisticated models and data mining techniques, in-depth...",cb8867c03dd90ae5,Associate Data Scientist,,40.8,3,19 days,2016-10-17 21:29:15.887221
541,"San Francisco, CA",MeetMe,"You will also provide architectural mentorship, and work with our Data Scientists, to ensure data is available in a consistent, timely, and reliable manner....",e685f45c887570f7,Data Pipeline Engineer,,,,3 hours,2016-10-17 21:29:15.887221
542,"Scarborough, ME",Alere,"This will include analysis of data related to quality control for final product, in-process manufacturing and intermediates, support validation efforts in...",807a4ed689f9d740,Statistician,,40.2,130,11 days,2016-10-17 21:29:15.887221
543,"Golden Valley, MN",Honeywell,"Data modeling, mining, pattern analysis, data visualization and machine learning solutions to address customer needs. Principal Data Scientist....",7c7f503691def6a4,Principal Data Scientist,,44.4,3477,2 days,2016-10-17 21:29:15.887221
544,"Foster City, CA",Techshed,"Manage programs to resolve common issues users encounter while using software, products or services of Redbeacon/The Home Depot....",d3d9b46d56a55d3c,Data Scientist,,,,28 days,2016-10-17 21:29:15.887221
545,"Houston, TX 77057 (Galleria-Uptown area)",Experis,"The role will partner with a multi-disciplinary group of industry experts, modellers and data scientists to innovate, develop and deploy new commercial...",c64f131cd83c8fda,Analytical Data Scientist,,43.8,296,17 days,2016-10-17 21:29:15.887221
546,"Ann Arbor, MI","Truven Health Analytics, an IBM Company","Work collaboratively with data scientists, clinicians, and other experts to ensure that methodologies meet the stated business requirements....",0b1ad09c2493741d,Methodologist (Data Analytics SME),,,,5 days,2016-10-17 21:29:15.887221
547,"Mountain View, CA 94043",Qeexo,"Our company brings together a unique combination of expertise in human computer interaction, machine learning, and hardware integration to create revolutionary...",263451f7b7f3d0cf,"Machine Learning Engineer, Implementation",,,,9 days,2016-10-17 21:29:15.887221
548,"Plymouth Meeting, PA",IMS Health,"Apply machine learning, data mining technologies in developing innovative solutions in pharmaceutical industry....",0aa270b42ade129d,Data Scientist,,44.4,439,30 days,2016-10-17 21:29:15.887221
549,"Boston, MA","PowerAdvocate, Inc",3+ years of relevant experience in classification-type Machine Learning projects. Do you want to be involved in delivering the next generation of analytic...,33f6492c7563a46e,Data Scientist,,42.0,2,13 days,2016-10-17 21:29:15.887221
550,"Oriskany, NY",XDuce,"The Business Analyst will work closely with data scientists, technology professionals and claims business partners in implementing advanced analytics models and...",cc665a7c2f152054,Business Analyst/predictive analytics/data science,,,,8 days,2016-10-17 21:29:15.887221
551,"Dearborn, MI 48124",ASG Renaissance,"In this role, you will support the data requirements of the Data Scientists who are using analytics to achieve business outcomes including insights to...",ffe0ae14f4bb772c,Data Analyst,,52.800003,6,3 days,2016-10-17 21:29:15.887221
552,"New York, NY",Willis Towers Watson,"Building upon our existing advanced analytics and data provisions services, RCS is currently broadening its big data predictive analytics capabilities and is...",23681e120ce7339c,Data Analytics Manager,,44.4,217,9 days,2016-10-17 21:29:15.887221
553,"Dallas-Fort Worth, TX",Oscar Technology,"""How much will our customers spend next year?""""What factors affect our business costs?""""How much will currency fluctuations affect international travel?""We have...",96463e7ac0f61c4f,Data Science Director,"$180,000 a year",,,18 days,2016-10-17 21:29:15.887221
